all_awardings,allow_live_comments,author,author_flair_css_class,author_flair_richtext,author_flair_text,author_flair_type,author_fullname,author_is_blocked,author_patreon_flair,author_premium,awarders,can_mod_post,contest_mode,created_utc,domain,full_link,gildings,id,is_created_from_ads_ui,is_crosspostable,is_meta,is_original_content,is_reddit_media_domain,is_robot_indexable,is_self,is_video,link_flair_background_color,link_flair_richtext,link_flair_text_color,link_flair_type,locked,media_only,no_follow,num_comments,num_crossposts,over_18,parent_whitelist_status,permalink,pinned,pwls,removed_by_category,retrieved_on,score,selftext,send_replies,spoiler,stickied,subreddit,subreddit_id,subreddit_subscribers,subreddit_type,thumbnail,title,total_awards_received,treatment_tags,upvote_ratio,url,whitelist_status,wls,suggested_sort,link_flair_template_id,link_flair_text,post_hint,preview,author_flair_template_id,author_flair_text_color
[],False,hashbrownmap,,[],,text,t2_fp6s898x,False,False,False,[],False,False,1634766890,self.cscareerquestions,https://www.reddit.com/r/cscareerquestions/comments/qcc0w2/got_sde_ii_instead_of_sde_i_as_new_grad/,{},qcc0w2,False,True,False,False,False,True,True,False,,"[{'e': 'text', 't': 'New Grad'}]",dark,richtext,False,False,True,4,0,False,all_ads,/r/cscareerquestions/comments/qcc0w2/got_sde_ii_instead_of_sde_i_as_new_grad/,False,6,,1634766901,1,"Senior student at a US university and been interviewing with a few companies for a new grad role after graduation. Finished final rounds with a company and they contacted me saying they want to give me a SDE II position instead of the new grad SDE I position. 

Has this happened to anyone else? If you took the offer what was your experience like? 

I thought I did well in the interview but my imposter syndrome is asking if I'll be able to live up to the expectations and responsibilities of the role...",True,False,False,cscareerquestions,t5_2sdpm,625584,public,self,Got SDE II instead of SDE I as New grad,0,[],1.0,https://www.reddit.com/r/cscareerquestions/comments/qcc0w2/got_sde_ii_instead_of_sde_i_as_new_grad/,all_ads,6,,05438160-1232-11e5-b573-0e1422b8b60b,New Grad,,,,
[],False,A_Curious_Redditor_,,[],,text,t2_dgge36pd,False,False,False,[],False,False,1634766827,self.cscareerquestions,https://www.reddit.com/r/cscareerquestions/comments/qcc03n/first_whiteboard_interview_need_helpasap/,{},qcc03n,False,False,False,False,False,False,True,False,,[],dark,text,False,False,True,2,0,False,all_ads,/r/cscareerquestions/comments/qcc03n/first_whiteboard_interview_need_helpasap/,False,6,moderator,1634766838,1,[removed],True,False,False,cscareerquestions,t5_2sdpm,625582,public,self,First whiteboard interview. Need help...ASAP...,0,[],1.0,https://www.reddit.com/r/cscareerquestions/comments/qcc03n/first_whiteboard_interview_need_helpasap/,all_ads,6,,,,,,,
[],False,AcanthocephalaTop889,,[],,text,t2_bx8fk1k4,False,False,False,[],False,False,1634766490,self.cscareerquestions,https://www.reddit.com/r/cscareerquestions/comments/qcbvtg/facebook_to_change_its_name/,{},qcbvtg,False,False,False,False,False,False,True,False,,"[{'e': 'text', 't': 'Meta'}]",dark,richtext,False,False,True,2,0,False,all_ads,/r/cscareerquestions/comments/qcbvtg/facebook_to_change_its_name/,False,6,moderator,1634766502,1,[removed],True,False,False,cscareerquestions,t5_2sdpm,625575,public,self,Facebook to change its name.,0,[],1.0,https://www.reddit.com/r/cscareerquestions/comments/qcbvtg/facebook_to_change_its_name/,all_ads,6,,1ae775c6-1232-11e5-bc2c-0e9aedb4175b,Meta,,,,
[],False,NeonGenesis666,,[],,text,t2_172zc5,False,False,False,[],False,False,1634765018,self.cscareerquestions,https://www.reddit.com/r/cscareerquestions/comments/qcbcrh/job_application_resume_parsers/,{},qcbcrh,False,False,False,False,False,False,True,False,,"[{'e': 'text', 't': 'New Grad'}]",dark,richtext,False,False,True,2,0,False,all_ads,/r/cscareerquestions/comments/qcbcrh/job_application_resume_parsers/,False,6,moderator,1634765029,1,[removed],True,False,False,cscareerquestions,t5_2sdpm,625555,public,self,Job Application Resume Parsers,0,[],1.0,https://www.reddit.com/r/cscareerquestions/comments/qcbcrh/job_application_resume_parsers/,all_ads,6,,05438160-1232-11e5-b573-0e1422b8b60b,New Grad,,,,
[],False,Feeling_Fruit_8684,,[],,text,t2_fhlh8uzi,False,False,False,[],False,False,1634764877,self.cscareerquestions,https://www.reddit.com/r/cscareerquestions/comments/qcbaww/best_buy_associate_swe_internship_in_mn/,{},qcbaww,False,True,False,False,False,True,True,False,,[],dark,text,False,False,True,0,0,False,all_ads,/r/cscareerquestions/comments/qcbaww/best_buy_associate_swe_internship_in_mn/,False,6,,1634764888,1,Just got an offer for their internship program as an Associate Software Engineer Intern next summer!  Tried looking up information on glassdoor and reddit but wasn't getting anywhere about their corporate jobs. Wondering if anyone had any experience or pros/cons about Best Buy and their work culture at their headquarters in Minnesota.,True,False,False,cscareerquestions,t5_2sdpm,625554,public,self,Best Buy Associate SWE internship in MN?,0,[],1.0,https://www.reddit.com/r/cscareerquestions/comments/qcbaww/best_buy_associate_swe_internship_in_mn/,all_ads,6,,,,,,,
[],False,throwaway_secondtime,,[],,text,t2_73wybs73,False,False,False,[],False,False,1634764362,self.cscareerquestions,https://www.reddit.com/r/cscareerquestions/comments/qcb47w/good_classes_for_research_engineer_positions_in/,{},qcb47w,False,True,False,False,False,True,True,False,,[],dark,text,False,False,True,0,0,False,all_ads,/r/cscareerquestions/comments/qcb47w/good_classes_for_research_engineer_positions_in/,False,6,,1634764373,1,"I have already taken a grad-level ML course, and I plan to take a deep learning and distributed systems course in the spring semester. For the third course, I have the option of taking one of the following courses in my MS program -

1. Advanced Optimization Algorithms - Gets into convex optimization and Linear Programming.
2. Statistical Learning Theory - Follows [this book](https://mitpress.ublish.com/ereader/7093/?preview=#page/Cover) by Dr. Mehryar Mohri.
3. Statistical Machine Learning - Follows ESLR closely.

Which course do you guys recommend I should take if my goal is to work in the industry as a research engineer?",True,False,False,cscareerquestions,t5_2sdpm,625551,public,self,Good classes for research engineer positions in the industry,0,[],1.0,https://www.reddit.com/r/cscareerquestions/comments/qcb47w/good_classes_for_research_engineer_positions_in/,all_ads,6,,,,,,,
[],False,FrostBlitz5745,,[],,text,t2_qoxsx,False,False,False,[],False,False,1634764172,self.cscareerquestions,https://www.reddit.com/r/cscareerquestions/comments/qcb1pa/will_a_data_engineering_internship_affect_my/,{},qcb1pa,False,True,False,False,False,True,True,False,,"[{'e': 'text', 't': 'Student'}]",dark,richtext,False,False,False,1,0,False,all_ads,/r/cscareerquestions/comments/qcb1pa/will_a_data_engineering_internship_affect_my/,False,6,,1634764183,1,"I am a sophomore that recently got an Amazon Data Engineering offer. I am a little hesitant to take it because I have concerns it my pigeonhole me out of SWE internships next year (and eventually new grad).

For context, I have two prior internships that are both “SWE” in title but both dealt with data engineering projects (i.e. building and deploying a data pipeline). If I take this offer, my resume will essentially be nothing but data work. Could this affect my future SWE opportunities? I do have somewhat of an interest in Data Engineering, but I want to leave doors open.

Thanks!",True,False,False,cscareerquestions,t5_2sdpm,625546,public,self,Will a Data Engineering internship affect my future SWE opportunities?,0,[],1.0,https://www.reddit.com/r/cscareerquestions/comments/qcb1pa/will_a_data_engineering_internship_affect_my/,all_ads,6,,c9dd4bf2-b859-11e3-8535-12313d31e5b1,Student,,,,
[],False,Substantial_Daikon24,,[],,text,t2_51nx2gcd,False,False,False,[],False,False,1634764111,self.cscareerquestions,https://www.reddit.com/r/cscareerquestions/comments/qcb0wm/salary_and_bonuses_opinion/,{},qcb0wm,False,True,False,False,False,True,True,False,,[],dark,text,False,False,True,4,0,False,all_ads,/r/cscareerquestions/comments/qcb0wm/salary_and_bonuses_opinion/,False,6,,1634764122,1,"Hello, I have recently got an offer with a fixed monthly sum + 5% yearly bonus based on EBITDA difference between current year and prior year, I’m not sure if it’s a good offer or not?
I’m ok with the fixed monthly sum because it is above what I’m getting now and I somehow wanted to get a percentage of the company shares because it is the CTO position. what do you guys think? The initial offer was 7.5% but got reduced because of investors to 5%.",True,False,False,cscareerquestions,t5_2sdpm,625545,public,self,Salary and bonuses opinion,0,[],1.0,https://www.reddit.com/r/cscareerquestions/comments/qcb0wm/salary_and_bonuses_opinion/,all_ads,6,,,,,,,
[],False,nervousaboutschool17,,[],,text,t2_3vtnyg3p,False,False,False,[],False,False,1634764034,self.cscareerquestions,https://www.reddit.com/r/cscareerquestions/comments/qcazvu/what_can_i_do_to_be_the_best_i_can_be_during_my_3/,{},qcazvu,False,True,False,False,False,True,True,False,,[],dark,text,False,False,False,0,0,False,all_ads,/r/cscareerquestions/comments/qcazvu/what_can_i_do_to_be_the_best_i_can_be_during_my_3/,False,6,,1634764045,1,"- What can I do outside of school

-I'm in Canada*

This is my program:
 https://www.senecacollege.ca/programs/fulltime/CPA.html

There's 2 co-op terms.",True,False,False,cscareerquestions,t5_2sdpm,625544,public,self,What can I do to be the best I can be during my 3 year advanced diploma,0,[],1.0,https://www.reddit.com/r/cscareerquestions/comments/qcazvu/what_can_i_do_to_be_the_best_i_can_be_during_my_3/,all_ads,6,,,,self,"{'enabled': False, 'images': [{'id': '1yNKRGk3j9JfJS91k79F2BoKCBMIGxUkU2jXp2pjVvw', 'resolutions': [{'height': 72, 'url': 'https://external-preview.redd.it/BByU6yYIoeXDHAk9hS0D5gm15Zx4RErXx-eP13KKNEE.jpg?width=108&amp;crop=smart&amp;auto=webp&amp;s=b1e5a2a3ff2a28bb6ac729c9674298f2b0755817', 'width': 108}, {'height': 144, 'url': 'https://external-preview.redd.it/BByU6yYIoeXDHAk9hS0D5gm15Zx4RErXx-eP13KKNEE.jpg?width=216&amp;crop=smart&amp;auto=webp&amp;s=2d04676126691657c66fe4aa6f754a61707bde41', 'width': 216}, {'height': 213, 'url': 'https://external-preview.redd.it/BByU6yYIoeXDHAk9hS0D5gm15Zx4RErXx-eP13KKNEE.jpg?width=320&amp;crop=smart&amp;auto=webp&amp;s=661340806a166b5fa4fb87f8a6eab5080cf3d4a5', 'width': 320}, {'height': 426, 'url': 'https://external-preview.redd.it/BByU6yYIoeXDHAk9hS0D5gm15Zx4RErXx-eP13KKNEE.jpg?width=640&amp;crop=smart&amp;auto=webp&amp;s=0f9467283ff15bb4ff8ffdda9ff9b2296c10a488', 'width': 640}, {'height': 640, 'url': 'https://external-preview.redd.it/BByU6yYIoeXDHAk9hS0D5gm15Zx4RErXx-eP13KKNEE.jpg?width=960&amp;crop=smart&amp;auto=webp&amp;s=fefa14699476023b6404966fc9d4f4cf6835a573', 'width': 960}, {'height': 720, 'url': 'https://external-preview.redd.it/BByU6yYIoeXDHAk9hS0D5gm15Zx4RErXx-eP13KKNEE.jpg?width=1080&amp;crop=smart&amp;auto=webp&amp;s=b0206cd9dc1004e95b68c36fdede864d1f5f2537', 'width': 1080}], 'source': {'height': 800, 'url': 'https://external-preview.redd.it/BByU6yYIoeXDHAk9hS0D5gm15Zx4RErXx-eP13KKNEE.jpg?auto=webp&amp;s=ebbe43725856f1a2c5aa5ec4af954e51f6ec0c38', 'width': 1200}, 'variants': {}}]}",,
[],False,Doctor-Jackall,,[],,text,t2_2tx49xg,False,False,False,[],False,False,1634763916,self.cscareerquestions,https://www.reddit.com/r/cscareerquestions/comments/qcayf1/i_need_a_little_bit_of_advice_regarding_career/,{},qcayf1,False,True,False,False,False,True,True,False,,[],dark,text,False,False,True,1,0,False,all_ads,/r/cscareerquestions/comments/qcayf1/i_need_a_little_bit_of_advice_regarding_career/,False,6,,1634763927,1,"I'm a robotics graduate who seeks a career in software development. In university I did little programming (mainly C++ and assembly), so I don't have much experience.

I worked in a software development company for 3 months, but they told me that I can't continue to work for them because I learn pretty slowly and they can't afford to pay me without delivering some useful software (It's understandable because they are a small company). To be honest, I'm not upset at all, because I'm aware of my low knowledge level at this point.

As for what I learnt, I spent two weeks on a beginner python course, which was pretty good at making me understand the basic syntax and concepts. But it's not enough because the tasks that were given to me require python libraries and frameworks knowledge and a good problem solving thinking, which I don't have at the moment.

 I felt overwhelmed by the amount of new things that I should learn in a short time. In addition to that, sometimes I have difficulties even with basic python concepts, so I'm clearly not prepared.

I can live pretty well a few months with the money I saved, so I was thinking about spending those months studying python and getting better at programming in general, to be able to get an entry level job in software development.

The thing is I really like to program and I would love to make a career out of it, but at this moment I'm clearly not ready. I was thinking about applying for different jobs in IT, but I'm not sure that's a good choice right now, because I'll encounter the same problems again.

What should I do ?


TL:DR : I'm a robotics graduate but I want to work in the IT field. I got hired by a small software company, but I can't continue to work with them because I don't have the required skills at this moment. I'm not sure if I should invest my time in learning and getting better or apply to another IT company.",True,False,False,cscareerquestions,t5_2sdpm,625544,public,self,I need a little bit of advice regarding career path,0,[],1.0,https://www.reddit.com/r/cscareerquestions/comments/qcayf1/i_need_a_little_bit_of_advice_regarding_career/,all_ads,6,,,,,,,
[],False,CaptainAFAB,,[],,text,t2_p1nbl,False,False,False,[],False,False,1634763624,self.cscareerquestions,https://www.reddit.com/r/cscareerquestions/comments/qcauo2/worried_about_getting_fired_due_to_mental_issues/,{},qcauo2,False,True,False,False,False,True,True,False,,"[{'e': 'text', 't': 'Experienced'}]",dark,richtext,False,False,False,2,0,False,all_ads,/r/cscareerquestions/comments/qcauo2/worried_about_getting_fired_due_to_mental_issues/,False,6,,1634763637,1,"I recently switched to a new developer job after some real struggles with my last company. The biggest problem was that they changed our insurance and after that point I struggled for over a year to get the mental health help I need, but kept hearing no new patients, we don't take that insurance anymore, and etcetera. Regular health stuff was fine, it just didn't work at all for any psychiatrists or counselors within 25 miles. (I live in a city and that was a totally absurd situation because there isn't any special shortage of them.) I was deteriorating badly and I needed to leave so I could get my mental health taken care of.

So. Around the end of September, I started at the new job. I signed up for new health insurance (best option available, the price is worth it for how much healthcare I need) which started October 1st. I finally got to see someone today, and I will be starting medication hopefully by early next week.

So far so good. Except that I have been struggling really hard learning the new code base, customs, and styles without that medication, and it shows. Once I start back on medication, it will take 4-8 weeks to have me fully back up to speed. I think that if I hadn't lived through over a year of bare knuckling my mental health problems, during a global pandemic no less, I wouldn't be in quite as bad shape as I am now. Alas.

I am, I believe reasonably so based on how much trouble I'm having getting PRs up, extremely scared that I'm going to get fired before I can get better. I have an upcoming chat with someone in HR but I'm not sure what to say. Telling someone is probably better than saying nothing at all, but I don't know what kind of support to ask for.

My issue is PTSD, and that's been confirmed by several doctors over the years, and just to be thorough I also had a full psych eval done, which showed, yes, I definitely have very bad PTSD. Because this is a lifelong condition with a lot of variation in expressed symptoms from individual to individual, I am particularly concerned about what ""reasonable accommodation"" would even mean.

Thanks for reading, and thanks for any advice you may have to offer me.",True,False,False,cscareerquestions,t5_2sdpm,625542,public,self,worried about getting fired due to mental issues,0,[],1.0,https://www.reddit.com/r/cscareerquestions/comments/qcauo2/worried_about_getting_fired_due_to_mental_issues/,all_ads,6,,0968d7a4-1232-11e5-a323-0e1422b8b60b,Experienced,,,,
[],False,xlittoboyxx,,[],,text,t2_8ysexi4,False,False,False,[],False,False,1634763145,self.cscareerquestions,https://www.reddit.com/r/cscareerquestions/comments/qcao8s/cant_decide_between_offers/,{},qcao8s,False,True,False,False,False,True,True,False,,[],dark,text,False,False,True,7,0,False,all_ads,/r/cscareerquestions/comments/qcao8s/cant_decide_between_offers/,False,6,,1634763155,1,"Company A is offering a salary of $66000 with a $2000 sign on. They're also paying 100% tuition of my masters and I'm completely remote.

Company B is offering a salary of $74000 with a $7500 sign on. They'd be paying $10000 of my tuition per year. I'd start out remote, but at some point I would have to relocate.

These are entry level positions and I'm not sure which offer I should take. If I take company A, I'd save a lot of money since I'd be living with my parents.",True,False,False,cscareerquestions,t5_2sdpm,625532,public,self,Can't decide between offers,0,[],1.0,https://www.reddit.com/r/cscareerquestions/comments/qcao8s/cant_decide_between_offers/,all_ads,6,,,,,,,
[],False,bcsamsquanch,,[],,text,t2_10kwn7,False,False,False,[],False,False,1634762697,self.cscareerquestions,https://www.reddit.com/r/cscareerquestions/comments/qcaiid/ranting_on_timed_coding_tests/,{},qcaiid,False,True,False,False,False,True,True,False,,[],dark,text,False,False,True,11,0,False,all_ads,/r/cscareerquestions/comments/qcaiid/ranting_on_timed_coding_tests/,False,6,,1634762708,1,"These things officially suck.

I just got asked to count the total occurrences of elements common to 2 lists and the \~10 lines took me 35 min. This is after a list of similar fails over the past 2 weeks. Sure I notice I was a little bit better that the first one I did but this leads into my point.

Problem solving is required sure but you also absolutely need to be used to the spotlight and pressure to succeed on these things. It's a skill in and of itself--a skill that takes time to develop but is totally worthless unless maybe you are trying to diffuse a bomb with code at the end of a 007 movie.

I have an interview with a big company coming up (one of the FAANGS) and the recruiter told me straight up most successful candidates practice on leetcode for 2 WEEKS prior. What a colossal waste of time!

In addition to already having a good job I have several other applications in late stages that gave me a take-home which I was able to deliver a proper solution on. I'm going to pass on the Kobayashi Maru crap from now on and stick with companies who are reasonable. There are plenty.",True,False,False,cscareerquestions,t5_2sdpm,625525,public,self,ranting on timed coding tests,0,[],1.0,https://www.reddit.com/r/cscareerquestions/comments/qcaiid/ranting_on_timed_coding_tests/,all_ads,6,,,,,,,
[],False,ben-gives-advice,,"[{'e': 'text', 't': 'Hiring Manager / Career Coach'}]",Hiring Manager / Career Coach,richtext,t2_cww51,False,False,False,[],False,False,1634762398,self.cscareerquestions,https://www.reddit.com/r/cscareerquestions/comments/qcaem0/is_there_a_need_for_tech_industry_career_coaching/,{},qcaem0,False,True,False,False,False,True,True,False,,"[{'e': 'text', 't': 'Lead/Manager'}]",dark,richtext,False,False,True,2,0,False,all_ads,/r/cscareerquestions/comments/qcaem0/is_there_a_need_for_tech_industry_career_coaching/,False,6,,1634762409,1,"I've been in the tech industry for almost 20 years, and I've been managing people in tech for a big chunk of that. I've gotten really good at helping people develop as leaders, line themselves up for promotion, and navigate job family changes. I really love that part of my job.   


But I'm really tired of managing projects, reporting on goal progress, creating resource estimates and negotiating with other managers. I'm happy to coach others on doing it well, I just don't really want to keep doing it myself.  


I see a ton of people seeking guidance and perspective on tech careers here and in related subs. It really seems like a way I could continue to feel useful and continue to help people succeed in this industry. It would also give me some much needed space and flexibility. 

But is it something people would be willing to pay for? I'm certain most of my clients would come out ahead financially. I don't have any delusions of making as much money as I do now. That's fine. But I think it's important to value my time and ensure that the people I'm working with are committed and invested in the process and practice. 

I really hope this doesn't seem like I'm trying to advertise. It's not my intent. I think my own professional network is sufficient to get clients if there's a need. I'm just looking for thoughts and perspective from the community.",True,False,False,cscareerquestions,t5_2sdpm,625519,public,self,Is there a need for tech industry career coaching services?,0,[],1.0,https://www.reddit.com/r/cscareerquestions/comments/qcaem0/is_there_a_need_for_tech_industry_career_coaching/,all_ads,6,,10926bda-1232-11e5-a7a9-0e9aedb4175b,Lead/Manager,,,21198bda-788a-11e2-aba8-12313d1839b0,dark
[],False,CrossfitChigga,,[],,text,t2_14rmrh,False,False,False,[],False,False,1634761905,self.cscareerquestions,https://www.reddit.com/r/cscareerquestions/comments/qca88m/help_choosing_between_two_offers/,{},qca88m,False,True,False,False,False,True,True,False,,"[{'e': 'text', 't': 'Experienced'}]",dark,richtext,False,False,True,4,0,False,all_ads,/r/cscareerquestions/comments/qca88m/help_choosing_between_two_offers/,False,6,,1634761916,1,"Recently received offers to both Amazon and Box and am having a lot of trouble deciding. Both offers are around the same TC \~180k. Box a bit lower but better benefits/perks. Same location and both projects sound equally interesting.

Seeing as comp/projects are the same level my main worries are:

1. Culture, pretty sure Box wins here
2. Name on resume, does Amazon open more doors as a FANG company?

Would greatly appreciate any insight on which company would you pick in my position and why?",True,False,False,cscareerquestions,t5_2sdpm,625514,public,self,Help choosing between two offers?,0,[],1.0,https://www.reddit.com/r/cscareerquestions/comments/qca88m/help_choosing_between_two_offers/,all_ads,6,,0968d7a4-1232-11e5-a323-0e1422b8b60b,Experienced,,,,
[],False,CrossfitChigga,,[],,text,t2_14rmrh,False,False,False,[],False,False,1634761653,self.cscareerquestions,https://www.reddit.com/r/cscareerquestions/comments/qca4xe/amazon_vs_box/,{},qca4xe,False,False,False,False,False,False,True,False,,[],dark,text,False,False,True,2,0,False,all_ads,/r/cscareerquestions/comments/qca4xe/amazon_vs_box/,False,6,moderator,1634761664,1,[removed],True,False,False,cscareerquestions,t5_2sdpm,625513,public,self,Amazon vs Box?,0,[],1.0,https://www.reddit.com/r/cscareerquestions/comments/qca4xe/amazon_vs_box/,all_ads,6,,,,,,,
[],False,Complex_Journalist60,,[],,text,t2_4ijdt38i,False,False,False,[],False,False,1634761285,self.cscareerquestions,https://www.reddit.com/r/cscareerquestions/comments/qca07a/why_tls_work_for_such_a_low_rate/,{},qca07a,False,True,False,False,False,True,True,False,,[],dark,text,False,False,True,5,0,False,all_ads,/r/cscareerquestions/comments/qca07a/why_tls_work_for_such_a_low_rate/,False,6,,1634761295,1,"I've been attending 2-3 bootcamps and Team Leads were working for $17 - $19/hr in a San Francisco and Seattle. 

My friends who attended similar bootcamps are asking the same question.

They have enough knowledge to get hired by bigger companies where they can make at least double their income. So, is everyone lying about getting the first job almost around $85K - $100K? Or Team Leads in most bootcamps are not aware of the salary outside?",True,False,False,cscareerquestions,t5_2sdpm,625508,public,self,Why TLs work for such a low rate?,0,[],1.0,https://www.reddit.com/r/cscareerquestions/comments/qca07a/why_tls_work_for_such_a_low_rate/,all_ads,6,,,,,,,
[],False,Salaciousavocados,,[],,text,t2_18dskmep,False,False,False,[],False,False,1634760910,self.cscareerquestions,https://www.reddit.com/r/cscareerquestions/comments/qc9v2h/faang_marketer_wanting_to_learn_cs_what_kind_of/,{},qc9v2h,False,False,False,False,False,False,True,False,,[],dark,text,False,False,True,2,0,False,all_ads,/r/cscareerquestions/comments/qc9v2h/faang_marketer_wanting_to_learn_cs_what_kind_of/,False,6,moderator,1634760921,1,[removed],True,False,False,cscareerquestions,t5_2sdpm,625506,public,self,FAANG marketer wanting to learn CS. What kind of opportunities will I see?,0,[],1.0,https://www.reddit.com/r/cscareerquestions/comments/qc9v2h/faang_marketer_wanting_to_learn_cs_what_kind_of/,all_ads,6,,,,,,,
