all_awardings,allow_live_comments,author,author_flair_css_class,author_flair_richtext,author_flair_text,author_flair_type,author_fullname,author_is_blocked,author_patreon_flair,author_premium,awarders,can_mod_post,contest_mode,created_utc,domain,full_link,gildings,id,is_created_from_ads_ui,is_crosspostable,is_meta,is_original_content,is_reddit_media_domain,is_robot_indexable,is_self,is_video,link_flair_background_color,link_flair_richtext,link_flair_text_color,link_flair_type,locked,media_only,no_follow,num_comments,num_crossposts,over_18,parent_whitelist_status,permalink,pinned,pwls,removed_by_category,retrieved_on,score,selftext,send_replies,spoiler,stickied,subreddit,subreddit_id,subreddit_subscribers,subreddit_type,thumbnail,title,total_awards_received,treatment_tags,upvote_ratio,url,whitelist_status,wls,suggested_sort,link_flair_template_id,link_flair_text,post_hint,preview,author_flair_template_id,author_flair_text_color
[],False,jobsearchstruggle,,[],,text,t2_5u9flvwp,False,False,False,[],False,False,1634779305,self.cscareerquestions,https://www.reddit.com/r/cscareerquestions/comments/qcg48o/unmarketable_tech_stack_at_first_job/,{},qcg48o,False,True,False,False,False,True,True,False,,[],dark,text,False,False,True,11,0,False,all_ads,/r/cscareerquestions/comments/qcg48o/unmarketable_tech_stack_at_first_job/,False,6,,1634779316,1,"Hey everyone,

I've been working at a startup in its very early stages for about a year and a half. This is my first job and most of my experience consists of writing and maintaining the front-end of a mobile app using a cross-platform framework that there barely is any demand in the market for. 

I mainly took the job out of desperation in the middle of Covid, with the hope of getting enough experience to then find something somewhere more established and stable. But now looking at job postings I feel like the experience I'm getting at my job isn't really doing me any favors, and almost feels like I'm pretty much in the same place as a year and a half ago, arguably even worse because I don't have access to those ""Entry level"" or ""New Grad"" postings anymore. I've been applying for Front-end positions, but most of those are catered to Web, which I'm definitely open to but don't have the relevant professional experience for on my resume (React, etc.).

Does anyone have any advice of what I should do going forward? Should I start projects with more relevant tech stacks? Or focus solely on LeetCode? 

Might be worth mentioning I'm not really targeting FAANG (mostly because it feels like such a reach) but either more established companies or at the very least late-stage start ups, as working for an early stage startup left me pretty jaded.",True,False,False,cscareerquestions,t5_2sdpm,625696,public,self,Unmarketable tech stack at first job,0,[],1.0,https://www.reddit.com/r/cscareerquestions/comments/qcg48o/unmarketable_tech_stack_at_first_job/,all_ads,6,,,,,,,
[],False,periwinkle9991,,[],,text,t2_dtsbohrg,False,False,False,[],False,False,1634778200,self.cscareerquestions,https://www.reddit.com/r/cscareerquestions/comments/qcfrvx/worried_this_career_path_isnt_suitable_for_women/,{},qcfrvx,False,False,False,False,False,False,True,False,,[],dark,text,False,False,True,0,0,False,all_ads,/r/cscareerquestions/comments/qcfrvx/worried_this_career_path_isnt_suitable_for_women/,False,6,moderator,1634778211,1,[removed],True,False,False,cscareerquestions,t5_2sdpm,625691,public,self,Worried this career path isn't suitable for women interested in marriage and kids,0,[],1.0,https://www.reddit.com/r/cscareerquestions/comments/qcfrvx/worried_this_career_path_isnt_suitable_for_women/,all_ads,6,,,,,,,
[],False,periwinkle9991,,[],,text,t2_dtsbohrg,False,False,False,[],False,False,1634777998,self.cscareerquestions,https://www.reddit.com/r/cscareerquestions/comments/qcfpep/having_a_breakdown_dont_think_this_career_is/,{},qcfpep,False,False,False,False,False,False,True,False,,"[{'e': 'text', 't': 'Experienced'}]",dark,richtext,False,False,True,0,0,False,all_ads,/r/cscareerquestions/comments/qcfpep/having_a_breakdown_dont_think_this_career_is/,False,6,moderator,1634778009,1,[removed],True,False,False,cscareerquestions,t5_2sdpm,625688,public,self,"Having a breakdown, don't think this career is suitable for women interested in marriage and kids",0,[],1.0,https://www.reddit.com/r/cscareerquestions/comments/qcfpep/having_a_breakdown_dont_think_this_career_is/,all_ads,6,,0968d7a4-1232-11e5-a323-0e1422b8b60b,Experienced,,,,
[],False,cheggLegend,,[],,text,t2_566ibaek,False,False,False,[],False,False,1634777942,self.cscareerquestions,https://www.reddit.com/r/cscareerquestions/comments/qcfotc/red_flag/,{},qcfotc,False,True,False,False,False,True,True,False,,"[{'e': 'text', 't': 'Experienced'}]",dark,richtext,False,False,True,14,0,False,all_ads,/r/cscareerquestions/comments/qcfotc/red_flag/,False,6,,1634777953,1,"Would you consider this a red flag for a company’s about page:

“Our founding team includes Silicon Valley leaders who have founded or been founding team members of multiple companies with successful exits, some in excess of $350 million. We convened a team uniquely qualified to bring modern solutions and some of the most advanced technologies to healthcare revenue cycle management.

We’ve built a cross-functional skill set deep into the DNA of the company. We have technology experts from the top Silicon Valley technology companies, many with graduate degrees in machine learning.”",True,False,False,cscareerquestions,t5_2sdpm,625687,public,self,Red Flag?,0,[],1.0,https://www.reddit.com/r/cscareerquestions/comments/qcfotc/red_flag/,all_ads,6,,0968d7a4-1232-11e5-a323-0e1422b8b60b,Experienced,,,,
[],False,ilovekeshi,,[],,text,t2_bqkbeil5,False,False,False,[],False,False,1634777406,self.cscareerquestions,https://www.reddit.com/r/cscareerquestions/comments/qcfiv4/tech_career_in_military/,{},qcfiv4,False,True,False,False,False,True,True,False,,[],dark,text,False,False,True,1,0,False,all_ads,/r/cscareerquestions/comments/qcfiv4/tech_career_in_military/,False,6,,1634777417,1,"Has anyone began their career in tech in the military ? 
If so, can you say that it prepared you well? 
Was it worth it? 
Do you regret taking this path? 

I’m in community college now but i’m thinking of doing the reserves with school and i want to know whether or not this would be a waste of time and energy or not.",True,False,False,cscareerquestions,t5_2sdpm,625680,public,self,Tech Career in Military,0,[],1.0,https://www.reddit.com/r/cscareerquestions/comments/qcfiv4/tech_career_in_military/,all_ads,6,,,,,,,
[],False,zippler14,,[],,text,t2_5ljxpqwd,False,False,False,[],False,False,1634777196,self.cscareerquestions,https://www.reddit.com/r/cscareerquestions/comments/qcfgk1/amplitude_swe_intern_oa/,{},qcfgk1,False,True,False,False,False,True,True,False,,[],dark,text,False,False,True,0,0,False,all_ads,/r/cscareerquestions/comments/qcfgk1/amplitude_swe_intern_oa/,False,6,,1634777207,1,Has anyone done the hackerrank OA for amplitude (software engineer intern 2022). What’s the level of difficulty? Thanks.,True,False,False,cscareerquestions,t5_2sdpm,625679,public,self,Amplitude SWE intern OA,0,[],1.0,https://www.reddit.com/r/cscareerquestions/comments/qcfgk1/amplitude_swe_intern_oa/,all_ads,6,,,,,,,
[],False,xxCrazyCatGuyxx,,[],,text,t2_1jtxkx3r,False,False,False,[],False,False,1634776870,self.cscareerquestions,https://www.reddit.com/r/cscareerquestions/comments/qcfcyh/cook_systems_fasttrack_program_legit/,{},qcfcyh,False,True,False,False,False,True,True,False,,[],dark,text,False,False,False,0,0,False,all_ads,/r/cscareerquestions/comments/qcfcyh/cook_systems_fasttrack_program_legit/,False,6,,1634776880,1,"I took a few assessments, passed. Resume, interview, passed those too. Got offered to partake in their program. 

It's a program that does a full stack boot camp for 8 weeks and then they place you in a job. Contract to hire. 

No relocation, no fees for leaving early. 

I've got zero developer work experience and I'm a junior in my computer science college degree. There seems to be about 100 applicants per intern position everywhere else so getting and internship seems like it would take dozens of hours of work with no guarantee of success and this seems to be a great opportunity.

I'm thinking about putting school on pause for 8 weeks to complete this to get out of my dead end factory job and then jump immediately back into school.

Does this seem like a bad deal, or bad idea?

If anyone has any experience with this or thoughts I would gladly appreciate any help. Thank you.",True,False,False,cscareerquestions,t5_2sdpm,625675,public,self,Cook Systems FastTrack program legit?,0,[],1.0,https://www.reddit.com/r/cscareerquestions/comments/qcfcyh/cook_systems_fasttrack_program_legit/,all_ads,6,,,,,,,
[],False,Retardemption,,[],,text,t2_2jv1fprq,False,False,False,[],False,False,1634776859,self.cscareerquestions,https://www.reddit.com/r/cscareerquestions/comments/qcfcu4/where_should_i_travel_while_working_remotely/,{},qcfcu4,False,True,False,False,False,True,True,False,,"[{'e': 'text', 't': 'Experienced'}]",dark,richtext,False,False,True,3,0,False,all_ads,/r/cscareerquestions/comments/qcfcu4/where_should_i_travel_while_working_remotely/,False,6,,1634776870,1,"Recently just started a job that’s remote for the near future. Haven’t been able to travel much for the past couple of years and now that I do have that freedom, would love to spend a couple weeks or so away from home. Thus, was wondering if anyone has travelled temporarily while being remote. Would love to hear some of your recommendations (preferably within the United States).",True,False,False,cscareerquestions,t5_2sdpm,625674,public,self,Where should I travel while working remotely?,0,[],1.0,https://www.reddit.com/r/cscareerquestions/comments/qcfcu4/where_should_i_travel_while_working_remotely/,all_ads,6,,0968d7a4-1232-11e5-a323-0e1422b8b60b,Experienced,,,,
[],False,-Knockabout,,[],,text,t2_kh2g3,False,False,False,[],False,False,1634775013,self.cscareerquestions,https://www.reddit.com/r/cscareerquestions/comments/qcerzd/living_in_perpetual_fear_of_being_fired/,{},qcerzd,False,True,False,False,False,True,True,False,,"[{'e': 'text', 't': 'New Grad'}]",dark,richtext,False,False,True,8,0,False,all_ads,/r/cscareerquestions/comments/qcerzd/living_in_perpetual_fear_of_being_fired/,False,6,,1634775024,1,"So to preface this, I have anxiety, and am between therapists, which probably explains a lot of this. However, I figured I'd post and see if anyone else is the same, and how they deal with it.

So, I was recently employed at a great job, one I can see myself staying at long-term. The pay isn't incredibly high, but it's plenty for me (being single, with no plans for kids), and the benefits are great (which I need, as someone with a chronic illness). The area I live in also isn't expensive, and the position itself is flexible on location, so I'm not tied down. So, suffice to say, I very much want to keep this job. And people seem to like me! Not all my jokes land (I think because I'm the youngest of my coworkers), but I've been told I'm doing a ""good job"", and going at the expected pace. Though I feel I'm too slow sometimes.

But every time I have to ask for clarification for something, or a joke doesn't land, or I take a bit longer than expected on a problem, I start thinking that this is just one of the things that will build up into me being let go. It's starting to really affect my confidence, and panicking so much isn't great for my work or heart.

If anyone else feels like this, how do you get through it? Do you?",True,False,False,cscareerquestions,t5_2sdpm,625653,public,self,Living in perpetual fear of being fired?,0,[],1.0,https://www.reddit.com/r/cscareerquestions/comments/qcerzd/living_in_perpetual_fear_of_being_fired/,all_ads,6,,05438160-1232-11e5-b573-0e1422b8b60b,New Grad,,,,
[],False,mikayla_rivera,,[],,text,t2_veq5w,False,False,False,[],False,False,1634774503,self.cscareerquestions,https://www.reddit.com/r/cscareerquestions/comments/qcem04/got_let_go_today_from_first_dev_job/,{},qcem04,False,True,False,False,False,True,True,False,,"[{'e': 'text', 't': 'New Grad'}]",dark,richtext,False,False,True,54,0,False,all_ads,/r/cscareerquestions/comments/qcem04/got_let_go_today_from_first_dev_job/,False,6,,1634774514,1,"Really just kind of came up pretty unexpectedly. Got a random zoom after standup meeting and was let go without warning after 10months working here for poor performance. 

I guess to some degree I saw it coming when I started working here and knew it would happen eventually. I’ve stayed this long for experience on my resume because I had a support background prior and an IT degree. There was also only 1 other dev on my team, no testing/staging, no 1v1 with mangers, we just started using tickets about 2 weeks ago so I’ve been getting projects from the other dev randomly, no documentation, everything is on fire, no training, and 12 devs left right before I was hired. I’ve switched from working with go, to JS, php, Wordpress, to a lot of devops/aws/networking now and have been struggling with migrating our entire backend from classic to vpc. The JS tasks I did fine but had no experience with go or AWS prior and they knew that. I have been able to complete other AWS tasks but this one has been harder because I’m learning aws at the same time. I could’ve asked more questions but didn’t because the senior was hard to talk to and not always very friendly so I usually asked devs online instead.

Anyways is this normal? I work remote and work long hours and still failed here. No severance, but I have savings so not worried. What can I do to improve? How’s the job market? Anyone else had this happen?",True,False,False,cscareerquestions,t5_2sdpm,625651,public,self,Got let go today from first dev job,0,[],1.0,https://www.reddit.com/r/cscareerquestions/comments/qcem04/got_let_go_today_from_first_dev_job/,all_ads,6,,05438160-1232-11e5-b573-0e1422b8b60b,New Grad,,,,
[],False,The-_Captain,,[],,text,t2_svcvf,False,False,False,[],False,False,1634774206,self.cscareerquestions,https://www.reddit.com/r/cscareerquestions/comments/qceib2/my_dad_wants_to_learn_programming_and_is/,{},qceib2,False,True,False,False,False,True,True,False,,"[{'e': 'text', 't': 'Experienced'}]",dark,richtext,False,False,True,14,0,False,all_ads,/r/cscareerquestions/comments/qceib2/my_dad_wants_to_learn_programming_and_is/,False,6,,1634774216,1,"I am a professional software engineer myself. My dad (50s) is transitioning out of his previous career. He's thinking of learning how to program and is looking at a few bootcamps. In his past life a long time ago, he was an electrical engineer so he's a smart, quantitative person (who also has an EE degree).

Any tips, especially from older developers, for him? Is it realistic for him to make this transition now?",True,False,False,cscareerquestions,t5_2sdpm,625648,public,self,My dad wants to learn programming and is considering a bootcamp. Is this realistic?,0,[],1.0,https://www.reddit.com/r/cscareerquestions/comments/qceib2/my_dad_wants_to_learn_programming_and_is/,all_ads,6,,0968d7a4-1232-11e5-a323-0e1422b8b60b,Experienced,,,,
[],False,Ok-Acanthisitta-3234,,[],,text,t2_cj7o16xv,False,False,False,[],False,False,1634774082,self.cscareerquestions,https://www.reddit.com/r/cscareerquestions/comments/qcegwp/should_i_be_worried/,{},qcegwp,False,True,False,False,False,True,True,False,,[],dark,text,False,False,True,1,0,False,all_ads,/r/cscareerquestions/comments/qcegwp/should_i_be_worried/,False,6,,1634774093,1,I'm a mid level software engineer that has worked in the finance industry for several years now. I've felt that I was under for a little while now so I decided to move companies. Financially the move was worth it. I received a 50% increase. The last couple of weeks has made me a little worried about my position at the new company. My manager has been trying to get me on other projects at the company so that I can cut my hours on the project that I was hired for. I'm ok with this but two of the projects that had openings didn't work out so that leaves one project that could use help but that's not guaranteed. So now I'm trying not to freak out about this. I'm not sure what would happen if that last project fell through too.,True,False,False,cscareerquestions,t5_2sdpm,625644,public,self,Should I be worried,0,[],1.0,https://www.reddit.com/r/cscareerquestions/comments/qcegwp/should_i_be_worried/,all_ads,6,,,,,,,
[],False,Spare-Resident-9857,,[],,text,t2_75qo55e3,False,False,False,[],False,False,1634774058,self.cscareerquestions,https://www.reddit.com/r/cscareerquestions/comments/qcegmk/amazon_onsite_interview_for_sde_ii_with_less_than/,{},qcegmk,False,False,False,False,False,False,True,False,,[],dark,text,False,False,True,2,0,False,all_ads,/r/cscareerquestions/comments/qcegmk/amazon_onsite_interview_for_sde_ii_with_less_than/,False,6,moderator,1634774069,1,[removed],True,False,False,cscareerquestions,t5_2sdpm,625644,public,self,Amazon onsite interview for SDE II with less than a year of experience,0,[],1.0,https://www.reddit.com/r/cscareerquestions/comments/qcegmk/amazon_onsite_interview_for_sde_ii_with_less_than/,all_ads,6,,,,,,,
[],False,evergreensnows,,[],,text,t2_dfsrc6wx,False,False,False,[],False,False,1634773570,self.cscareerquestions,https://www.reddit.com/r/cscareerquestions/comments/qceatn/stripeplaid_2022_internship_status/,{},qceatn,False,True,False,False,False,True,True,False,,"[{'e': 'text', 't': 'Student'}]",dark,richtext,False,False,True,0,0,False,all_ads,/r/cscareerquestions/comments/qceatn/stripeplaid_2022_internship_status/,False,6,,1634773582,1,I was wondering if anyone knows if Plaid/Stripe have already started interviewing or giving out coding challenges. Sent in a job app last month but haven’t heard anything. I got an awesome offer already but fintech is a field I’d rather be in. Basically want to know if I got ghosted or if I should shoot them an email to try and speed up the process (have one month to sign).,True,False,False,cscareerquestions,t5_2sdpm,625640,public,self,Stripe/Plaid 2022 Internship Status,0,[],1.0,https://www.reddit.com/r/cscareerquestions/comments/qceatn/stripeplaid_2022_internship_status/,all_ads,6,,c9dd4bf2-b859-11e3-8535-12313d31e5b1,Student,,,,
[],False,Pat_Bateman1,,[],,text,t2_9zzdn3ia,False,False,False,[],False,False,1634773412,self.cscareerquestions,https://www.reddit.com/r/cscareerquestions/comments/qce8y1/process_engineering_after_amazon/,{},qce8y1,False,True,False,False,False,True,True,False,,[],dark,text,False,False,True,1,0,False,all_ads,/r/cscareerquestions/comments/qce8y1/process_engineering_after_amazon/,False,6,,1634773423,1,Was curious for those of you that have worked at Amazon as a PE (5 or 6) where did you go after? What are some similar positions at other companies? PE is a broad term and I’ve noticed the responsibilities very greatly from company to company.,True,False,False,cscareerquestions,t5_2sdpm,625638,public,self,Process Engineering after Amazon,0,[],1.0,https://www.reddit.com/r/cscareerquestions/comments/qce8y1/process_engineering_after_amazon/,all_ads,6,,,,,,,
[],False,Pat_Bateman1,,[],,text,t2_9zzdn3ia,False,False,False,[],False,False,1634773209,self.cscareerquestions,https://www.reddit.com/r/cscareerquestions/comments/qce6jx/process_engineer_at_amazon_exit_opportunities/,{},qce6jx,False,False,False,False,False,False,True,False,,[],dark,text,False,False,True,2,0,False,all_ads,/r/cscareerquestions/comments/qce6jx/process_engineer_at_amazon_exit_opportunities/,False,6,moderator,1634773220,1,[removed],True,False,False,cscareerquestions,t5_2sdpm,625636,public,self,Process Engineer at Amazon exit opportunities,0,[],1.0,https://www.reddit.com/r/cscareerquestions/comments/qce6jx/process_engineer_at_amazon_exit_opportunities/,all_ads,6,,,,,,,
[],False,MyButterKnuckles,,[],,text,t2_1w5si95t,False,False,False,[],False,False,1634772475,self.cscareerquestions,https://www.reddit.com/r/cscareerquestions/comments/qcdxut/how_do_you_control_your_fear_of_being_left_behind/,{},qcdxut,False,True,False,False,False,True,True,False,,"[{'e': 'text', 't': 'New Grad'}]",dark,richtext,False,False,False,19,0,False,all_ads,/r/cscareerquestions/comments/qcdxut/how_do_you_control_your_fear_of_being_left_behind/,False,6,,1634772486,1,"I understand how fast and swift the changes can be in the tech world in terms of the skills that you need to do the job. But I can't seem to shake off the fact that I am constantly thinking of what to study/practice. So much so, that I feel burnt out right now from overworking myself. Would love to hear your perspectives/advice.",True,False,False,cscareerquestions,t5_2sdpm,625628,public,self,How do you control your fear of being left behind in terms of skills?,0,[],1.0,https://www.reddit.com/r/cscareerquestions/comments/qcdxut/how_do_you_control_your_fear_of_being_left_behind/,all_ads,6,,05438160-1232-11e5-b573-0e1422b8b60b,New Grad,,,,
[],False,canadian_Biscuit,,[],,text,t2_60o2t76l,False,False,False,[],False,False,1634772459,self.cscareerquestions,https://www.reddit.com/r/cscareerquestions/comments/qcdxnk/is_it_worth_accepting_a_position_at_a_company/,{},qcdxnk,False,True,False,False,False,True,True,False,,[],dark,text,False,False,True,2,0,False,all_ads,/r/cscareerquestions/comments/qcdxnk/is_it_worth_accepting_a_position_at_a_company/,False,6,,1634772469,1,"I am currently a full-stack software engineer with 2 years of overall work experience. I currently work in a mid-sized company that is extremely mismanaged along with the project itself. Everything that could possibly go wrong with a project has been observed in mine, and I’m burnt out being the forefront of these problems with no senior engineer or team lead to guide me. I was recently offered a position as a UI Engineer that involves development in angular. Overall the company is amazing, the work/life balance is great, the benefits are an improvement, and the salary is $20,000 above what I’m currently making. I’m not sure if I want to become a UI Engineer, nor am I ready to be pigeon-holed into a framework and language, however I’m in desperate need of working in a more stable environment. I’m not against working with angular and personally love the tool, however I feel like my interests are more expansive. Is it worth jumping on this offer, or will i be leading my career towards defined path as a front end/UI guy that I’m trying to avoid. To add, by only focusing on one aspect of a software application, I do hope I can learn how to develop cleaner code and cleaner architecture, which is currently difficult to do when I’m trying to juggle multiple hats in my current position (and no mentorship).",True,False,False,cscareerquestions,t5_2sdpm,625628,public,self,"Is it worth accepting a position at a company with a higher salary, better work/life balance, recognized name, but a position shift?",0,[],1.0,https://www.reddit.com/r/cscareerquestions/comments/qcdxnk/is_it_worth_accepting_a_position_at_a_company/,all_ads,6,,,,,,,
[],False,TomBakerFTW,,[],,text,t2_dvy3y,False,False,False,[],False,False,1634772430,self.cscareerquestions,https://www.reddit.com/r/cscareerquestions/comments/qcdxbt/first_coding_job_going_terribly_how_should_i/,{},qcdxbt,False,True,False,False,False,True,True,False,,[],dark,text,False,False,True,7,0,False,all_ads,/r/cscareerquestions/comments/qcdxbt/first_coding_job_going_terribly_how_should_i/,False,6,,1634772442,1,"I graduated from a web dev bootcamp in April 2020 (unfortunate timing) and got a job a year later. It's a really small company and they pay me pretty well for someone with no previous professional experience. 

Only problem is the environment SUCKS. You can tell the CEO doesn't trust the employees by the extremely restrictive environment and I'm the only person who knows JavaScript, so there's no one else for me to really learn from. Some days I don't even get to touch a line of code, though I have completed a couple of projects that built my confidence a bit. 

To give you some reference for where I'm at, I know JavaScript and a little bit of PHP but I don't even understand most of the prompts when it comes to Leetcode easy questions.

I know that this is a really bad position to start my career with, and I know I will grow faster if I can learn from other developers on the job, but I'm not really qualified for most of the jobs I see posted. I'm having major imposter syndrome after bombing the hell out of a tech interview with another company and I'm nervous about my future.

My question is: How should I spend my time to make up for these disadvantages?

I'm reviewing all of the concepts that I didn't understand in the tech interview I bombed, but I would love some insight from other professionals on how I can pivot into a position with a larger company where I can learn directly from other devs.",True,False,False,cscareerquestions,t5_2sdpm,625627,public,self,First coding job going terribly - How should I prepare for my next job?,0,[],1.0,https://www.reddit.com/r/cscareerquestions/comments/qcdxbt/first_coding_job_going_terribly_how_should_i/,all_ads,6,,,,,,,
