all_awardings,allow_live_comments,author,author_flair_css_class,author_flair_richtext,author_flair_text,author_flair_type,author_fullname,author_is_blocked,author_patreon_flair,author_premium,awarders,can_mod_post,contest_mode,created_utc,domain,full_link,gildings,id,is_created_from_ads_ui,is_crosspostable,is_meta,is_original_content,is_reddit_media_domain,is_robot_indexable,is_self,is_video,link_flair_background_color,link_flair_richtext,link_flair_text_color,link_flair_type,locked,media_only,no_follow,num_comments,num_crossposts,over_18,parent_whitelist_status,permalink,pinned,pwls,removed_by_category,retrieved_on,score,selftext,send_replies,spoiler,stickied,subreddit,subreddit_id,subreddit_subscribers,subreddit_type,thumbnail,title,total_awards_received,treatment_tags,upvote_ratio,url,whitelist_status,wls,suggested_sort,link_flair_template_id,link_flair_text,post_hint,preview,author_flair_template_id,author_flair_text_color
[],False,romannumeral_,,[],,text,t2_nhoe30h,False,False,False,[],False,False,1634810341,self.cscareerquestions,https://www.reddit.com/r/cscareerquestions/comments/qcoc8f/is_a_phd_necessaryclearly_better_than_ms_for_a/,{},qcoc8f,False,False,False,False,False,False,True,False,,[],dark,text,False,False,True,2,0,False,all_ads,/r/cscareerquestions/comments/qcoc8f/is_a_phd_necessaryclearly_better_than_ms_for_a/,False,6,moderator,1634810352,1,[removed],True,False,False,cscareerquestions,t5_2sdpm,626008,public,self,Is a PhD necessary/clearly better than MS for a tech research job?,0,[],1.0,https://www.reddit.com/r/cscareerquestions/comments/qcoc8f/is_a_phd_necessaryclearly_better_than_ms_for_a/,all_ads,6,,,,,,,
[],False,Academic_Basis5221,,[],,text,t2_8omg590d,False,False,False,[],False,False,1634809257,self.cscareerquestions,https://www.reddit.com/r/cscareerquestions/comments/qco3h0/software_development_engineer_2022_amazon/,{},qco3h0,False,False,False,False,False,False,True,False,,[],dark,text,False,False,True,2,0,False,all_ads,/r/cscareerquestions/comments/qco3h0/software_development_engineer_2022_amazon/,False,6,moderator,1634809268,1,[removed],True,False,False,cscareerquestions,t5_2sdpm,625996,public,self,Software Development Engineer 2022 - Amazon,0,[],1.0,https://www.reddit.com/r/cscareerquestions/comments/qco3h0/software_development_engineer_2022_amazon/,all_ads,6,,,,,,,
[],False,GrandKnightMaster,,[],,text,t2_eo5dhbwm,False,False,False,[],False,False,1634805860,self.cscareerquestions,https://www.reddit.com/r/cscareerquestions/comments/qcnd8i/best_place_to_learnbecome_a_selftaught_software/,{},qcnd8i,False,True,False,False,False,True,True,False,,[],dark,text,False,False,True,1,0,False,all_ads,/r/cscareerquestions/comments/qcnd8i/best_place_to_learnbecome_a_selftaught_software/,False,6,,1634805871,1,"What online resources are the best ones for learning or becoming a self-taught software developer?  

I am currently using Codecademy premium to learning coding (worth on python 3 and intermediate  python)",True,False,False,cscareerquestions,t5_2sdpm,625973,public,self,Best place to learn/become a self-taught software developer?,0,[],1.0,https://www.reddit.com/r/cscareerquestions/comments/qcnd8i/best_place_to_learnbecome_a_selftaught_software/,all_ads,6,,,,,,,
[],False,CuriousKid5667,,[],,text,t2_9bpckgg3,False,False,False,[],False,False,1634804546,self.cscareerquestions,https://www.reddit.com/r/cscareerquestions/comments/qcn2rr/stranger_is_impersonating_coworker_and_sending_me/,{},qcn2rr,False,True,False,False,False,True,True,False,,[],dark,text,False,False,True,11,0,False,all_ads,/r/cscareerquestions/comments/qcn2rr/stranger_is_impersonating_coworker_and_sending_me/,False,6,,1634804557,1,"Today I received an email (i thought) from my coworker asking me to reply since he is working remotely.

Then I thought, it might be some issue on his phone so he must be emailing me. I then replied with an affirmative tone. 

But then I received another mail asking to do transactions (with a hyperlink which I will not open) on his behalf. And that’s where i thought the red flag is.

Issue for me is not about the scam.  Main concern is someone is trying to impersonate my coworker and possibly 
vice versa on their side. 

Should i notify coworker or to the CEO (Currently working at a small startup)",True,False,False,cscareerquestions,t5_2sdpm,625958,public,self,Stranger is impersonating coworker and sending me emails. Should I notify?,0,[],1.0,https://www.reddit.com/r/cscareerquestions/comments/qcn2rr/stranger_is_impersonating_coworker_and_sending_me/,all_ads,6,,,,,,,
[],False,DradenG,,[],,text,t2_mbpdbc1,False,False,False,[],False,False,1634801956,self.cscareerquestions,https://www.reddit.com/r/cscareerquestions/comments/qcmgxu/how_to_leave_interview_once_you_realize_you_are/,{},qcmgxu,False,False,False,False,False,False,True,False,,[],dark,text,False,False,True,2,0,False,all_ads,/r/cscareerquestions/comments/qcmgxu/how_to_leave_interview_once_you_realize_you_are/,False,6,moderator,1634801966,1,[removed],True,False,False,cscareerquestions,t5_2sdpm,625930,public,self,How to leave interview once you realize you are no longer interested in the company?,0,[],1.0,https://www.reddit.com/r/cscareerquestions/comments/qcmgxu/how_to_leave_interview_once_you_realize_you_are/,all_ads,6,,,,,,,
[],False,tralalei,,[],,text,t2_6lkicv4x,False,False,False,[],False,False,1634800572,self.cscareerquestions,https://www.reddit.com/r/cscareerquestions/comments/qcm4lh/how_to_include_moocs_in_resume/,{},qcm4lh,False,False,False,False,False,False,True,False,,[],dark,text,False,False,True,2,0,False,all_ads,/r/cscareerquestions/comments/qcm4lh/how_to_include_moocs_in_resume/,False,6,moderator,1634800583,1,[removed],True,False,False,cscareerquestions,t5_2sdpm,625912,public,self,How to include MOOCs in resume ?,0,[],1.0,https://www.reddit.com/r/cscareerquestions/comments/qcm4lh/how_to_include_moocs_in_resume/,all_ads,6,,,,,,,
[],False,CSCQMods,,[],,text,t2_7t7ivtl0,False,False,False,[],False,False,1634799740,self.cscareerquestions,https://www.reddit.com/r/cscareerquestions/comments/qclxev/daily_chat_thread_october_21_2021/,{},qclxev,False,True,False,False,False,True,True,False,,[],dark,text,False,False,True,31,0,False,all_ads,/r/cscareerquestions/comments/qclxev/daily_chat_thread_october_21_2021/,False,6,,1634799751,1,"Please use this thread to chat, have casual discussions, and ask casual questions. Moderation will be light, but don't be a jerk.

This thread is posted **every day at midnight PST**. Previous Daily Chat Threads can be found [here](https://www.reddit.com/r/cscareerquestions/search?q=Daily+Chat+Thread&amp;restrict_sr=on&amp;sort=new&amp;t=all).",False,False,True,cscareerquestions,t5_2sdpm,625905,public,self,"Daily Chat Thread - October 21, 2021",0,[],1.0,https://www.reddit.com/r/cscareerquestions/comments/qclxev/daily_chat_thread_october_21_2021/,all_ads,6,new,,,,,,
[],False,pedyram,,[],,text,t2_136sv1,False,False,False,[],False,False,1634799625,self.cscareerquestions,https://www.reddit.com/r/cscareerquestions/comments/qclwdy/heard_of_any_experience_with_salary_in/,{},qclwdy,False,True,False,False,False,True,True,False,,"[{'e': 'text', 't': 'Experienced'}]",dark,richtext,False,False,True,6,0,False,all_ads,/r/cscareerquestions/comments/qclwdy/heard_of_any_experience_with_salary_in/,False,6,,1634799642,1,"- Which currencies could it be?
- Are they normally to evade laws?
- Is there any totally legal way for it?
- Any other points which you consider interesting for anyone about to apply for such a position?",True,False,False,cscareerquestions,t5_2sdpm,625905,public,self,Heard of any experience with salary in cryptocurrency?,0,[],1.0,https://www.reddit.com/r/cscareerquestions/comments/qclwdy/heard_of_any_experience_with_salary_in/,all_ads,6,,0968d7a4-1232-11e5-a323-0e1422b8b60b,Experienced,,,,
[],False,CSCQMods,,[],,text,t2_7t7ivtl0,False,False,False,[],False,False,1634799619,self.cscareerquestions,https://www.reddit.com/r/cscareerquestions/comments/qclw82/interview_discussion_october_21_2021/,{},qclw82,False,True,False,False,False,True,True,False,,[],dark,text,False,False,True,35,0,False,all_ads,/r/cscareerquestions/comments/qclw82/interview_discussion_october_21_2021/,False,6,,1634799631,1,"Please use this thread to have discussions about interviews, interviewing, and interview prep. Posts focusing solely on interviews created outside of this thread will probably be removed.
        
Abide by the rules, don't be a jerk.
        
This thread is posted each **Monday and Thursday at midnight PST**. Previous Interview Discussion threads can be found [here](https://www.reddit.com/r/cscareerquestions/search?q=Interview+Discussion&amp;restrict_sr=on&amp;sort=new&amp;t=all).",False,False,True,cscareerquestions,t5_2sdpm,625905,public,self,"Interview Discussion - October 21, 2021",0,[],1.0,https://www.reddit.com/r/cscareerquestions/comments/qclw82/interview_discussion_october_21_2021/,all_ads,6,new,,,,,,
[],False,diorlipsticks,,[],,text,t2_fpo85rl1,False,False,False,[],False,False,1634799443,self.cscareerquestions,https://www.reddit.com/r/cscareerquestions/comments/qcluo6/what_should_i_do_with_this_resume_to_change_my_job/,{},qcluo6,False,False,False,False,False,False,True,False,,[],dark,text,False,False,True,2,0,False,all_ads,/r/cscareerquestions/comments/qcluo6/what_should_i_do_with_this_resume_to_change_my_job/,False,6,moderator,1634799453,1,[removed],True,False,False,cscareerquestions,t5_2sdpm,625906,public,self,What should I do with this resume to change my job?,0,[],1.0,https://www.reddit.com/r/cscareerquestions/comments/qcluo6/what_should_i_do_with_this_resume_to_change_my_job/,all_ads,6,,,,,,,
[],False,fgd0380,,[],,text,t2_6z1lqhch,False,False,False,[],False,False,1634798262,self.cscareerquestions,https://www.reddit.com/r/cscareerquestions/comments/qclkfz/freshman_internship/,{},qclkfz,False,True,False,False,False,True,True,False,,"[{'e': 'text', 't': 'Student'}]",dark,richtext,False,False,True,0,0,False,all_ads,/r/cscareerquestions/comments/qclkfz/freshman_internship/,False,6,,1634798274,1,"
Hey guys! I’m a current freshman at college, and I’m trying to look for internships for the upcoming summer. 
Ideally I would want an swe internship, but I don’t think I have the skills for that yet(algos, data structures, etc).
Would it be reasonable for me to aim for some frontend internships because I have more experience in that field? 

Also this is a side question, but I joined a college startup this quarter, but the work hasn’t started yet, how should I put this on my resume? I know what I will be doing in the startup.",True,False,False,cscareerquestions,t5_2sdpm,625900,public,self,Freshman internship,0,[],1.0,https://www.reddit.com/r/cscareerquestions/comments/qclkfz/freshman_internship/,all_ads,6,,c9dd4bf2-b859-11e3-8535-12313d31e5b1,Student,,,,
[],False,Guilty_Raise8212,,[],,text,t2_c4b3g14y,False,False,False,[],False,False,1634797726,self.cscareerquestions,https://www.reddit.com/r/cscareerquestions/comments/qclflw/unreasonable_expectations_for_a_website/,{},qclflw,False,True,False,False,False,True,True,False,,[],dark,text,False,False,True,12,0,False,all_ads,/r/cscareerquestions/comments/qclflw/unreasonable_expectations_for_a_website/,False,6,,1634797737,1,"Hi, I recently started a new job at a startup as a software developer with 2 years of commercial experience. 

Right off the bat I was told they needed their website updated because their old one looks shit and takes forever to load.

They gave me a half-done solution made by some indian developers they used before and expect me to finish it in two weeks.

Most of my experience was in web development, not design. I need to learn a front-end JS library first and it’s going to take time. I haven’t even been introduced to their database properly yet and I have only just now started using the API for pulling the data.

I have only been here one week. How can I break the alarm bell to them that it’s not happening and I need at least two months to make it happen? Honestly I don’t care if they fire me because they have no clue how software development is done and they are clearly oblivious that it’s not that simple.",True,False,False,cscareerquestions,t5_2sdpm,625894,public,self,Unreasonable expectations for a website,0,[],1.0,https://www.reddit.com/r/cscareerquestions/comments/qclflw/unreasonable_expectations_for_a_website/,all_ads,6,,,,,,,
[],False,FIREWORKKS,,[],,text,t2_btzdz,False,False,False,[],False,False,1634797586,self.cscareerquestions,https://www.reddit.com/r/cscareerquestions/comments/qclecc/how_to_prepare_for_internship_technical_interview/,{},qclecc,False,False,False,False,False,False,True,False,,"[{'e': 'text', 't': 'Student'}]",dark,richtext,False,False,True,2,0,False,all_ads,/r/cscareerquestions/comments/qclecc/how_to_prepare_for_internship_technical_interview/,False,6,moderator,1634797597,1,[removed],True,False,False,cscareerquestions,t5_2sdpm,625893,public,self,How to prepare for internship technical interview with no coding,0,[],1.0,https://www.reddit.com/r/cscareerquestions/comments/qclecc/how_to_prepare_for_internship_technical_interview/,all_ads,6,,c9dd4bf2-b859-11e3-8535-12313d31e5b1,Student,,,,
[],False,Apprehensive-Pin4626,,[],,text,t2_a1zrzyq7,False,False,False,[],False,False,1634797401,self.cscareerquestions,https://www.reddit.com/r/cscareerquestions/comments/qclcmw/is_it_possible_to_do_a_software_engineer/,{},qclcmw,False,True,False,False,False,True,True,False,,[],dark,text,False,False,True,13,0,False,all_ads,/r/cscareerquestions/comments/qclcmw/is_it_possible_to_do_a_software_engineer/,False,6,,1634797412,1,"Hello, I am just wondering, has anyone done FT studies and SWE Internship at the same time? How was it for you?  I am thinking of doing it in the winter semester and It is my last year at my Uni too.",True,False,False,cscareerquestions,t5_2sdpm,625890,public,self,Is it possible to do a software engineer internship and full time student at the same time?,0,[],1.0,https://www.reddit.com/r/cscareerquestions/comments/qclcmw/is_it_possible_to_do_a_software_engineer/,all_ads,6,,,,,,,
[],False,maybelater98,,[],,text,t2_bp90xcl1,False,False,False,[],False,False,1634797344,self.cscareerquestions,https://www.reddit.com/r/cscareerquestions/comments/qclc44/confused_with_career_choice/,{},qclc44,False,True,False,False,False,True,True,False,,[],dark,text,False,False,False,0,0,False,all_ads,/r/cscareerquestions/comments/qclc44/confused_with_career_choice/,False,6,,1634797355,1,"I graduated in 2020 with an electronics degree and currently working as an ABAP consultant in India. 

Should I continue with SAP? I feel like I have pigeonholed to SAP for the rest of my career with no experience with other tech stacks and no direction as to where to begin. On the other hand, I might regret leaving SAP since SAP consultants do get paid well. 

Any suggestion as to which tech I could try and pursue?  Since I'm completely new to this I'm not sure which job profiles would suit me, but I do enjoy coding and the logical aspect of things.Also, if you know any books/courses, that would be very helpful.

Thanks a lot for reading. Would love to hear from y'all.",True,False,False,cscareerquestions,t5_2sdpm,625890,public,self,Confused with Career choice,0,[],1.0,https://www.reddit.com/r/cscareerquestions/comments/qclc44/confused_with_career_choice/,all_ads,6,,,,,,,
[],False,ArcaneLearner,,[],,text,t2_9udkd190,False,False,False,[],False,False,1634795475,self.cscareerquestions,https://www.reddit.com/r/cscareerquestions/comments/qckuoh/honest_input_about_interview/,{},qckuoh,False,False,False,False,False,False,True,False,,[],dark,text,False,False,True,2,0,False,all_ads,/r/cscareerquestions/comments/qckuoh/honest_input_about_interview/,False,6,moderator,1634795485,1,[removed],True,False,False,cscareerquestions,t5_2sdpm,625872,public,self,Honest Input about Interview,0,[],1.0,https://www.reddit.com/r/cscareerquestions/comments/qckuoh/honest_input_about_interview/,all_ads,6,,,,,,,
[],False,Venulegolas,,[],,text,t2_43srgd2c,False,False,False,[],False,False,1634794918,self.cscareerquestions,https://www.reddit.com/r/cscareerquestions/comments/qckplf/does_everyone_in_it_work_more_than_8_hours_a_day/,{},qckplf,False,True,False,False,False,True,True,False,,"[{'e': 'text', 't': 'Experienced'}]",dark,richtext,False,False,True,17,0,False,all_ads,/r/cscareerquestions/comments/qckplf/does_everyone_in_it_work_more_than_8_hours_a_day/,False,6,,1634794928,1,"Even on so called ""crunch"" projects where the slave master...I mean ""client"".... Wants something done ""ultra fast"" ?

I ask because from where I come, people working 10-12 hours a day in the office seems to be the norm, even for relatively relaxed projects.",True,False,False,cscareerquestions,t5_2sdpm,625868,public,self,Does everyone in IT work MORE than 8 hours a day?,0,[],1.0,https://www.reddit.com/r/cscareerquestions/comments/qckplf/does_everyone_in_it_work_more_than_8_hours_a_day/,all_ads,6,,0968d7a4-1232-11e5-a323-0e1422b8b60b,Experienced,,,,
[],False,GroundbreakingRun927,,[],,text,t2_e2negwio,False,False,False,[],False,False,1634794550,self.cscareerquestions,https://www.reddit.com/r/cscareerquestions/comments/qckm6d/how_to_best_play_the_jira_game/,{},qckm6d,False,True,False,False,False,True,True,False,,[],dark,text,False,False,True,36,0,False,all_ads,/r/cscareerquestions/comments/qckm6d/how_to_best_play_the_jira_game/,False,6,,1634794561,1,"In less Jira-y projects my focus is writing maintainable high-quality software.  In the case of my current Jira org though there seems to be one God: The Jira ticket.  

No one gives a shit you didn't use prop-types or define a TS interface, or even bother to destructure the props for a modicum of IntelliSense in that new 13-prop React Component; it does what it needs to do(right now at least).  The next guy can just be Luke Skywalker, close his eyes and guess the exact function signature based on your one `props:any` param; you did it champ.  The only thing management cares about is how many cards you can shuffle across the Jira board from left to right.

So I've adjusted my habits accordingly, if fixing `X` doesn't help me fix my current ticket, I don't see it. But I'm wondering if the Reddit hivemind can enlighten me on a better path, or help validate my current mindset.",True,False,False,cscareerquestions,t5_2sdpm,625864,public,self,"How to best play ""The Jira game""?",0,[],1.0,https://www.reddit.com/r/cscareerquestions/comments/qckm6d/how_to_best_play_the_jira_game/,all_ads,6,,,,,,,
[],False,sukjun1229,,[],,text,t2_4hb22f1d,False,False,False,[],False,False,1634794537,self.cscareerquestions,https://www.reddit.com/r/cscareerquestions/comments/qckm1r/resume_in_pdf_gets_badly_scanned_everytime/,{},qckm1r,False,False,False,False,False,False,True,False,,[],dark,text,False,False,True,2,0,False,all_ads,/r/cscareerquestions/comments/qckm1r/resume_in_pdf_gets_badly_scanned_everytime/,False,6,moderator,1634794548,1,[removed],True,False,False,cscareerquestions,t5_2sdpm,625864,public,self,Resume in PDF Gets Badly Scanned Everytime,0,[],1.0,https://www.reddit.com/r/cscareerquestions/comments/qckm1r/resume_in_pdf_gets_badly_scanned_everytime/,all_ads,6,,,,,,,
[],False,Snoo_1043,,[],,text,t2_6panacdd,False,False,False,[],False,False,1634794390,self.cscareerquestions,https://www.reddit.com/r/cscareerquestions/comments/qckklx/does_deepmind_or_google_x_require_noncompete/,{},qckklx,False,False,False,False,False,False,True,False,,[],dark,text,False,False,True,2,0,False,all_ads,/r/cscareerquestions/comments/qckklx/does_deepmind_or_google_x_require_noncompete/,False,6,moderator,1634794402,1,[removed],True,False,False,cscareerquestions,t5_2sdpm,625863,public,self,Does DeepMind or Google X require Non-Compete Agreements? Do any other elite teams/companies do so?,0,[],1.0,https://www.reddit.com/r/cscareerquestions/comments/qckklx/does_deepmind_or_google_x_require_noncompete/,all_ads,6,,,,,,,
[],False,oldsoulmoney,,[],,text,t2_49cu7krm,False,False,False,[],False,False,1634792120,self.cscareerquestions,https://www.reddit.com/r/cscareerquestions/comments/qcjym8/questions_to_ask_interviewers_end_of_interview/,{},qcjym8,False,False,False,False,False,False,True,False,,[],dark,text,False,False,True,2,0,False,all_ads,/r/cscareerquestions/comments/qcjym8/questions_to_ask_interviewers_end_of_interview/,False,6,moderator,1634792131,1,[removed],True,False,False,cscareerquestions,t5_2sdpm,625840,public,self,Questions to Ask Interviewers @ end of interview,0,[],1.0,https://www.reddit.com/r/cscareerquestions/comments/qcjym8/questions_to_ask_interviewers_end_of_interview/,all_ads,6,,,,,,,
[],False,SmallBlueAlien,,[],,text,t2_ua1w5ts,False,False,False,[],False,False,1634791826,self.cscareerquestions,https://www.reddit.com/r/cscareerquestions/comments/qcjvv6/what_should_i_get_my_masters_in_if_my_goal_is_to/,{},qcjvv6,False,True,False,False,False,True,True,False,,[],dark,text,False,False,True,5,0,False,all_ads,/r/cscareerquestions/comments/qcjvv6/what_should_i_get_my_masters_in_if_my_goal_is_to/,False,6,,1634791837,1,"I’m considering either software engineering or something AI related, would either of these be a good master’s to go into for this path? Also my background is in something else so please be patient with me",True,False,False,cscareerquestions,t5_2sdpm,625838,public,self,What should I get my master’s in if my goal is to help engineer assistive technologies?,0,[],1.0,https://www.reddit.com/r/cscareerquestions/comments/qcjvv6/what_should_i_get_my_masters_in_if_my_goal_is_to/,all_ads,6,,,,,,,
[],False,Calvin8r_42,,[],,text,t2_1v0tczwv,False,False,False,[],False,False,1634791230,self.cscareerquestions,https://www.reddit.com/r/cscareerquestions/comments/qcjq2j/nonsoftware_engineering_careers/,{},qcjq2j,False,True,False,False,False,True,True,False,,[],dark,text,False,False,False,4,0,False,all_ads,/r/cscareerquestions/comments/qcjq2j/nonsoftware_engineering_careers/,False,6,,1634791242,1," I need help. (please!)

I  am graduating with a BS in CS this coming spring and am looking for something besides software engineering. I had a DevOps internship which  was somewhat enjoyable, as well as working at the medical devices center  on campus with VR development and 3D printing which was more up my  alley.

I am really interested in  machinery and vehicles, but it seems as though most of the development  is done by electrical engineers. Similar story with manufacturing (from  my research).

Basically I am  looking for something that is more... physical and hands on, where I can see the results in the real world, and am struggling finding a path forward.

Any suggestions are greatly appreciated!!",True,False,False,cscareerquestions,t5_2sdpm,625833,public,self,Non-Software Engineering Careers?,0,[],1.0,https://www.reddit.com/r/cscareerquestions/comments/qcjq2j/nonsoftware_engineering_careers/,all_ads,6,,,,,,,
[],False,Ok-Cockroach2572,,[],,text,t2_5pxd7cp6,False,False,False,[],False,False,1634791084,self.cscareerquestions,https://www.reddit.com/r/cscareerquestions/comments/qcjojy/fb_vs_microsoft/,{},qcjojy,False,False,False,False,False,False,True,False,,"[{'e': 'text', 't': 'Experienced'}]",dark,richtext,False,False,True,2,0,False,all_ads,/r/cscareerquestions/comments/qcjojy/fb_vs_microsoft/,False,6,moderator,1634791094,1,[removed],True,False,False,cscareerquestions,t5_2sdpm,625833,public,self,Fb vs Microsoft,0,[],1.0,https://www.reddit.com/r/cscareerquestions/comments/qcjojy/fb_vs_microsoft/,all_ads,6,,0968d7a4-1232-11e5-a323-0e1422b8b60b,Experienced,,,,
[],False,aase_nomad,,[],,text,t2_dcg9cyif,False,False,False,[],False,False,1634790863,self.cscareerquestions,https://www.reddit.com/r/cscareerquestions/comments/qcjm9j/experience_dev_resume/,{},qcjm9j,False,False,False,False,False,False,True,False,,[],dark,text,False,False,True,2,0,False,all_ads,/r/cscareerquestions/comments/qcjm9j/experience_dev_resume/,False,6,moderator,1634790874,1,[removed],True,False,False,cscareerquestions,t5_2sdpm,625831,public,self,Experience dev resume,0,[],1.0,https://www.reddit.com/r/cscareerquestions/comments/qcjm9j/experience_dev_resume/,all_ads,6,,,,,,,
[],False,Infinite_Sleep_8663,,[],,text,t2_fpj5yls9,False,False,False,[],False,False,1634789265,self.cscareerquestions,https://www.reddit.com/r/cscareerquestions/comments/qcj601/i_got_my_first_internship_as_a_fifth_year_senior/,{},qcj601,False,True,False,False,False,True,True,False,,[],dark,text,False,False,True,0,0,False,all_ads,/r/cscareerquestions/comments/qcj601/i_got_my_first_internship_as_a_fifth_year_senior/,False,6,,1634789275,1,"I've applied to hundreds of places throughout college. I go to a no-name school, my GPA is 3.22, I have a super ethnic name, lots of connections but none that were willing to help. So many things against me. I've made it to the final round in plenty of interviews, but I was always the backup, never the chosen. Finally, I had a fortune 100 company reach out to me at Grace Hopper and I got the position through soft skills alone. I'm not sure what the takeaway is, but I just never thought I would end up at a well known company",True,False,False,cscareerquestions,t5_2sdpm,625812,public,self,I got my first internship as a fifth year senior in college,0,[],1.0,https://www.reddit.com/r/cscareerquestions/comments/qcj601/i_got_my_first_internship_as_a_fifth_year_senior/,all_ads,6,,,,,,,
