all_awardings,allow_live_comments,author,author_flair_css_class,author_flair_richtext,author_flair_text,author_flair_type,author_fullname,author_is_blocked,author_patreon_flair,author_premium,awarders,can_mod_post,contest_mode,created_utc,domain,full_link,gildings,id,is_created_from_ads_ui,is_crosspostable,is_meta,is_original_content,is_reddit_media_domain,is_robot_indexable,is_self,is_video,link_flair_background_color,link_flair_richtext,link_flair_text_color,link_flair_type,locked,media_only,no_follow,num_comments,num_crossposts,over_18,parent_whitelist_status,permalink,pinned,pwls,removed_by_category,retrieved_on,score,selftext,send_replies,spoiler,stickied,subreddit,subreddit_id,subreddit_subscribers,subreddit_type,thumbnail,title,total_awards_received,treatment_tags,upvote_ratio,url,whitelist_status,wls,suggested_sort,link_flair_template_id,link_flair_text,post_hint,preview,author_flair_template_id,author_flair_text_color
[],False,toastonaboat,,[],,text,t2_linwg,False,False,False,[],False,False,1634788239,self.cscareerquestions,https://www.reddit.com/r/cscareerquestions/comments/qciv66/continue_apm_internship_or_go_back_to_my_old_dev/,{},qciv66,False,True,False,False,False,True,True,False,,[],dark,text,False,False,True,0,0,False,all_ads,/r/cscareerquestions/comments/qciv66/continue_apm_internship_or_go_back_to_my_old_dev/,False,6,,1634788249,1,"Hi everyone. Confused uni student here. 

&amp;#x200B;

Bit of background about me. I've interned at a startup for 1 year, mostly working with Reactjs, and PHP. I really hated PHP, and overall found the direction of the company to be pretty dysfunctional, so I started looking for internships/grad roles at different companies. I got an offer from a pretty large B2B SaaS company after interviewing for them as an APM and Software Engineer. They knocked back my Software Engineering application because they thought I'd be better suited as an APM, I did both interviews pretty well. 

&amp;#x200B;

I took the offer as an APM because I had nothing else lined up and I was about to graduate in 3 months back then, and their grad package was a lot higher than what the startup offered me. However, I absolutely hate the role of an APM. It's so business/sales focused at this company and I feel as though I'm wasting valuable time I can gain as a developer. I spoke to my manager about this and they said they offer career planning every 6 months if you opt into that program, and said if you want to switch to a dev role then you can.

&amp;#x200B;

I left on pretty good terms with the previous startup, with my ex tech lead being a pretty good friend of mine to this day, he mentioned I'm always welcomed back. I'm at a bit of a crossroads here, do I go take the job at the old startup, or slug it out at this current role for 6 months, the B2B company uses React as well and Java, however I'd opt to go into their Java team because I enjoy working with it more.

&amp;#x200B;

Has anyone ever done a similar sort of transition? Will staying as an APM hinder my career?",True,False,False,cscareerquestions,t5_2sdpm,625802,public,self,Continue APM Internship or go back to my old dev gig?,0,[],1.0,https://www.reddit.com/r/cscareerquestions/comments/qciv66/continue_apm_internship_or_go_back_to_my_old_dev/,all_ads,6,,,,,,,
[],False,tittyrit,,[],,text,t2_zmusvn5,False,False,False,[],False,False,1634788120,self.cscareerquestions,https://www.reddit.com/r/cscareerquestions/comments/qcitxs/rejection_call_tips/,{},qcitxs,False,True,False,False,False,True,True,False,,[],dark,text,False,False,True,4,0,False,all_ads,/r/cscareerquestions/comments/qcitxs/rejection_call_tips/,False,6,,1634788131,1,"Unfortunately, after making it to the final round with MSFT, I did not receive an offer. My recruiter reached out to schedule a 15-minute call to relay feedback from my interviewers. This is the first time I had a call with a recruiter after a rejection. Are there any tips/advice that I should keep in mind heading into the call?

I was planning on taking note of feedback and perhaps asking some questions regarding future applications if time allows. Am I missing anything else?",True,False,False,cscareerquestions,t5_2sdpm,625801,public,self,Rejection Call Tips,0,[],1.0,https://www.reddit.com/r/cscareerquestions/comments/qcitxs/rejection_call_tips/,all_ads,6,,,,,,,
[],False,Signal-Post9616,,[],,text,t2_fpilktam,False,False,False,[],False,False,1634787848,self.cscareerquestions,https://www.reddit.com/r/cscareerquestions/comments/qcir52/how_do_you_get_an_internship_at_a_top_company/,{},qcir52,False,False,False,False,False,False,True,False,,"[{'e': 'text', 't': 'Student'}]",dark,richtext,False,False,True,2,0,False,all_ads,/r/cscareerquestions/comments/qcir52/how_do_you_get_an_internship_at_a_top_company/,False,6,moderator,1634787859,1,[removed],True,False,False,cscareerquestions,t5_2sdpm,625795,public,self,How do you get an internship at a top company (FAANG) when...,0,[],1.0,https://www.reddit.com/r/cscareerquestions/comments/qcir52/how_do_you_get_an_internship_at_a_top_company/,all_ads,6,,c9dd4bf2-b859-11e3-8535-12313d31e5b1,Student,,,,
[],False,kbrdsmsh-asdf,,[],,text,t2_70873j0v,False,False,False,[],False,False,1634787691,self.cscareerquestions,https://www.reddit.com/r/cscareerquestions/comments/qcipho/thinking_about_moving_into_ux_miserable_as_a/,{},qcipho,False,True,False,False,False,True,True,False,,"[{'e': 'text', 't': 'Experienced'}]",dark,richtext,False,False,True,3,0,False,all_ads,/r/cscareerquestions/comments/qcipho/thinking_about_moving_into_ux_miserable_as_a/,False,6,,1634787702,1,"These past three years as a full-time software engineer have been pretty stressful for me, and I'm not sure if I should wait it out to see if I get better at software engineering. I don't think I'm good at it, and I don't enjoy optimizing my code or staring at code, or staring at PRs. There's just mostly anxiety when I'm assigned something. I just bash my head against a problem until it works.

I have three questions;

Has anybody felt like this in a swe position, but it got better suddenly? How? 

Am I overglorifying how jobs are supposed to be? I want to enjoy my job, but a lot of people seem to say that placing priority on 'enjoyment' on a job is just plain impractical. 

Does anybody know anyone who has made a transition from SWE to UX or UX to SWE?",True,False,False,cscareerquestions,t5_2sdpm,625793,public,self,thinking about moving into UX. miserable as a software engineer,0,[],1.0,https://www.reddit.com/r/cscareerquestions/comments/qcipho/thinking_about_moving_into_ux_miserable_as_a/,all_ads,6,,0968d7a4-1232-11e5-a323-0e1422b8b60b,Experienced,,,,
[],False,devfuckedup,,[],,text,t2_71c544hg,False,False,False,[],False,False,1634787231,self.cscareerquestions,https://www.reddit.com/r/cscareerquestions/comments/qcikfr/are_you_supposed_to_want_to_climb_the_ladder/,{},qcikfr,False,True,False,False,False,True,True,False,,[],dark,text,False,False,True,18,0,False,all_ads,/r/cscareerquestions/comments/qcikfr/are_you_supposed_to_want_to_climb_the_ladder/,False,6,,1634787243,1,"When I started in ""tech"" I wanted to be a sysadmin. So when I went to college this was kind of the lens I thought through. It became obvious that college was not a requirement for this job so I quit. I worked as a sysadmin for about 5 years and it was fine and I probably would have continued to be a sysadmin but there were some management changes I didn't like so I moved to a new company as a ""Devops"" engineer. This was better increased pay more interesting work. While being a devops engineer I got the opportunity to go work at a startup ( 5 people in a garage the classic tale) . At the startup I realized being a devops engineer was not great so I slowly evolved into a Software Engineer And this was ok, it made more sense anyways for a company of that size and all was good. Eventually we did ok and the company was acquired. I didn't love the acquiring company so I went ahead and moved onto another company as a ""Sr"" Devops engineer. Thats where I am now I enjoy my work.

  I was talking to a friend who works at google and he was unhappy that he wont get promoted as fast as he would like. I was kinda shocked I thought "" Wow this guy makes a TON of money  why is he upset?"" Well the reason he is upset is because he wants his career to keep moving forward. So this got me thinking am I supposed to want to move up? Its not that I don't want to. But I don't want to be a manager yet I feel like I have a TON to learn. Obviously there are ways to move up and not be a manager.

I guess I always thought I would work and make enough money to eventually start my own company or just spend more time working on things I am personally interested in. Climbing the corporate ladder is just not an option that I really ever gave much thought.  

I guess I am at a point where I feel like ok I can start a company at least I have the funds if thats what I want to do.  But I never considered this idea of joining a large company ( the company I work at is growing fast enough) In order to ""climb the ladder"" if you will. 

&amp;#x200B;

I guess I am wondering if climbing the ladder makes sense? I already make more money than I need but certainly not as much as I want. It just seems like there is a TON I need to learn to keep moving up as an engineer and I am not sure the associated stress is really worth it. 

If any one has reached a high level at a company like Google I am curious to know how you thought about reaching that goal?",True,False,False,cscareerquestions,t5_2sdpm,625783,public,self,are you supposed to want to climb the ladder?,0,[],1.0,https://www.reddit.com/r/cscareerquestions/comments/qcikfr/are_you_supposed_to_want_to_climb_the_ladder/,all_ads,6,,,,,,,
[],False,cs_quant,,[],,text,t2_ehia91es,False,False,False,[],False,False,1634787065,self.cscareerquestions,https://www.reddit.com/r/cscareerquestions/comments/qciilz/most_usefulpractical_books_to_read_as_a_new_grad/,{},qciilz,False,True,False,False,False,True,True,False,,[],dark,text,False,False,True,0,0,False,all_ads,/r/cscareerquestions/comments/qciilz/most_usefulpractical_books_to_read_as_a_new_grad/,False,6,,1634787075,1,"Hello everybody,

Will be getting a BS CS in about 1year.
What are the most useful/practical books I can read to set myself apart from other new grads and potentially perform better once I get in the field ?",True,False,False,cscareerquestions,t5_2sdpm,625783,public,self,Most useful/practical books to read as a new grad,0,[],1.0,https://www.reddit.com/r/cscareerquestions/comments/qciilz/most_usefulpractical_books_to_read_as_a_new_grad/,all_ads,6,,,,,,,
[],False,Vivid-Temporary-1534,,[],,text,t2_fpgmswlk,False,False,False,[],False,False,1634786412,self.cscareerquestions,https://www.reddit.com/r/cscareerquestions/comments/qcib81/is_it_possible_to_avoid_company_walkouts_are/,{},qcib81,False,True,False,False,False,True,True,False,,[],dark,text,False,False,False,6,0,False,all_ads,/r/cscareerquestions/comments/qcib81/is_it_possible_to_avoid_company_walkouts_are/,False,6,,1634786422,1,"I‘m currently in the process of preparing for big tech interviews. The only concern I have about working for these companies is that I’ll be labeled as the enemy if I don’t participate in walkouts, protests, or general political bashing. Is it possible to avoid this (I.e. the recent walkout at Netflix)? Or is participation effectively mandatory to prove political loyalty? I appreciate your advice.",True,False,False,cscareerquestions,t5_2sdpm,625773,public,self,Is it possible to avoid company walkouts? Are non-walkouters labeled as the enemy?,0,[],1.0,https://www.reddit.com/r/cscareerquestions/comments/qcib81/is_it_possible_to_avoid_company_walkouts_are/,all_ads,6,,,,,,,
[],False,my3redditaccount,,[],,text,t2_a4fy7srn,False,False,False,[],False,False,1634785196,self.cscareerquestions,https://www.reddit.com/r/cscareerquestions/comments/qchxer/changing_major_after_accepting_job_offer/,{},qchxer,False,True,False,False,False,True,True,False,,[],dark,text,False,False,False,3,0,False,all_ads,/r/cscareerquestions/comments/qchxer/changing_major_after_accepting_job_offer/,False,6,,1634785207,1,"I'm in my final semester of college and I recently accepted a job offer for a software engineering position. However, during the recruitment process I listed my bachelor's degree as a double major in CS and physics. If I decide to drop my physics major, would the company care (especially wondering for the background check)? Should I let them know somehow?",True,False,False,cscareerquestions,t5_2sdpm,625760,public,self,Changing major after accepting job offer?,0,[],1.0,https://www.reddit.com/r/cscareerquestions/comments/qchxer/changing_major_after_accepting_job_offer/,all_ads,6,,,,,,,
[],False,ohmybubbles,,[],,text,t2_31mw76q6,False,False,False,[],False,False,1634784371,self.cscareerquestions,https://www.reddit.com/r/cscareerquestions/comments/qchoi3/amazon_sde_internship_oa1_unexpected_format/,{},qchoi3,False,False,False,False,False,False,True,False,,"[{'e': 'text', 't': 'Student'}]",dark,richtext,False,False,True,2,0,False,all_ads,/r/cscareerquestions/comments/qchoi3/amazon_sde_internship_oa1_unexpected_format/,False,6,moderator,1634784382,1,[removed],True,False,False,cscareerquestions,t5_2sdpm,625753,public,self,Amazon SDE Internship OA1: Unexpected format?,0,[],1.0,https://www.reddit.com/r/cscareerquestions/comments/qchoi3/amazon_sde_internship_oa1_unexpected_format/,all_ads,6,,c9dd4bf2-b859-11e3-8535-12313d31e5b1,Student,,,,
[],False,shaidyn,,[],,text,t2_70ecf,False,False,False,[],False,False,1634783937,self.cscareerquestions,https://www.reddit.com/r/cscareerquestions/comments/qchjot/making_the_jump_to_team_lead_is_education_the/,{},qchjot,False,True,False,False,False,True,True,False,,"[{'e': 'text', 't': 'Lead/Manager'}]",dark,richtext,False,False,True,1,0,False,all_ads,/r/cscareerquestions/comments/qchjot/making_the_jump_to_team_lead_is_education_the/,False,6,,1634783947,1,"Hey, folks! I'm currently a QA automation engineer, with about 7 years' experience, and I've been a dev in the past. In the distant past, before my CS career begin, I was a team lead in several different jobs, so I'm comfortable coaching, mentoring, scheduling, and resolving conflicts.

I'm trying to make the jump to QA team lead, and to no-one's surprise it's a pretty big hurdle. I get to a third interview on nearly any team lead job I apply for, and then a very polite email that they've decided to go for someone who has more experience. The classic ""You need experience to get experience.""

In my current job my boss has spoken to me about advancing my career and moving up. I'm taking some internal training courses, and leading meetings here and there, which is all well and good. But I've also kept an eye on org announcements and nearly no team lead positions are filled by internal candidates, it's mostly people coming from outside the company. So while my boss may have the best of intentions, the pattern doesn't support my hopes and dreams, and it's more likely I'm filling an assistant team lead role without the title or pay.

After that long intro, on to my question: Can I entice hiring managers to take a chance on me with more education? The whole reason I got started in CS was because while I liked computers, I had no specific qualifications. I went to school, got a 2 year diploma and broke into the industry. Things stagnated so I went back and did 2 more years to finish off my degree and higher pay followed almost immediately.

That was a very clear path, though. I don't know how leadership works. I don't have time to futz about with a full on BA or MBA, but what other options are there? Is there any sort of certification or one year program for ""new leaders"" or something that won't look like a waste of money on a resume?

Thanks.",True,False,False,cscareerquestions,t5_2sdpm,625747,public,self,Making the jump to team lead - Is education the bridge?,0,[],1.0,https://www.reddit.com/r/cscareerquestions/comments/qchjot/making_the_jump_to_team_lead_is_education_the/,all_ads,6,,10926bda-1232-11e5-a7a9-0e9aedb4175b,Lead/Manager,,,,
[],False,tboi23,,[],,text,t2_5qf8p0se,False,False,False,[],False,False,1634783591,self.cscareerquestions,https://www.reddit.com/r/cscareerquestions/comments/qchfx4/amazon_oa_tips/,{},qchfx4,False,False,False,False,False,False,True,False,,[],dark,text,False,False,True,2,0,False,all_ads,/r/cscareerquestions/comments/qchfx4/amazon_oa_tips/,False,6,moderator,1634783602,1,[removed],True,False,False,cscareerquestions,t5_2sdpm,625745,public,self,Amazon OA tips?,0,[],1.0,https://www.reddit.com/r/cscareerquestions/comments/qchfx4/amazon_oa_tips/,all_ads,6,,,,,,,
[],False,brainer1000,,[],,text,t2_dr6ylnzn,False,False,False,[],False,False,1634783524,self.cscareerquestions,https://www.reddit.com/r/cscareerquestions/comments/qchf7j/how_did_you_spend_your_first_year_cs_salary/,{},qchf7j,False,True,False,False,False,True,True,False,,"[{'e': 'text', 't': 'Student'}]",dark,richtext,False,False,True,374,0,False,all_ads,/r/cscareerquestions/comments/qchf7j/how_did_you_spend_your_first_year_cs_salary/,False,6,,1634783536,1,"saw this on another sub recently, curious..",True,False,False,cscareerquestions,t5_2sdpm,625744,public,self,how did you spend your first year CS salary?,0,[],1.0,https://www.reddit.com/r/cscareerquestions/comments/qchf7j/how_did_you_spend_your_first_year_cs_salary/,all_ads,6,,c9dd4bf2-b859-11e3-8535-12313d31e5b1,Student,,,,
[],False,ballLikeJohnWall,,[],,text,t2_9t3xh8kf,False,False,False,[],False,False,1634782175,self.cscareerquestions,https://www.reddit.com/r/cscareerquestions/comments/qch03t/has_anyone_ever_gone_back_to_previous_team_after/,{},qch03t,False,True,False,False,False,True,True,False,,[],dark,text,False,False,True,0,0,False,all_ads,/r/cscareerquestions/comments/qch03t/has_anyone_ever_gone_back_to_previous_team_after/,False,6,,1634782187,1,"I switched teams internally to a new team in a different org, but am now regretting it after a couple of months. Has anyone ever switched back to their previous team after leaving? If so could you share your experience?",True,False,False,cscareerquestions,t5_2sdpm,625727,public,self,Has anyone ever gone back to previous team after switching?,0,[],1.0,https://www.reddit.com/r/cscareerquestions/comments/qch03t/has_anyone_ever_gone_back_to_previous_team_after/,all_ads,6,,,,,,,
[],False,tiffepiphany,,[],,text,t2_49e19ypr,False,False,False,[],False,False,1634782138,self.cscareerquestions,https://www.reddit.com/r/cscareerquestions/comments/qcgzp3/when_do_you_accept_job_offer_vs_continuing_to/,{},qcgzp3,False,False,False,False,False,False,True,False,,"[{'e': 'text', 't': 'New Grad'}]",dark,richtext,False,False,True,2,0,False,all_ads,/r/cscareerquestions/comments/qcgzp3/when_do_you_accept_job_offer_vs_continuing_to/,False,6,moderator,1634782149,1,[removed],True,False,False,cscareerquestions,t5_2sdpm,625727,public,self,When do you accept job offer vs continuing to keep interviewing?,0,[],1.0,https://www.reddit.com/r/cscareerquestions/comments/qcgzp3/when_do_you_accept_job_offer_vs_continuing_to/,all_ads,6,,05438160-1232-11e5-b573-0e1422b8b60b,New Grad,,,,
[],False,tiffepiphany,,[],,text,t2_49e19ypr,False,False,False,[],False,False,1634781618,self.cscareerquestions,https://www.reddit.com/r/cscareerquestions/comments/qcgtp9/accepting_expiring_offer_vs_continuing_to/,{},qcgtp9,False,False,False,False,False,False,True,False,,"[{'e': 'text', 't': 'New Grad'}]",dark,richtext,False,False,True,2,0,False,all_ads,/r/cscareerquestions/comments/qcgtp9/accepting_expiring_offer_vs_continuing_to/,False,6,moderator,1634781634,1,[removed],True,False,False,cscareerquestions,t5_2sdpm,625721,public,self,"Accepting Expiring Offer vs. Continuing to Interview, Important Factors",0,[],1.0,https://www.reddit.com/r/cscareerquestions/comments/qcgtp9/accepting_expiring_offer_vs_continuing_to/,all_ads,6,,05438160-1232-11e5-b573-0e1422b8b60b,New Grad,,,,
[],False,NYUUndergrad2121,,[],,text,t2_d59p8ezc,False,False,False,[],False,False,1634780991,self.cscareerquestions,https://www.reddit.com/r/cscareerquestions/comments/qcgmnv/college_coursesmath_curriculum_for_operations/,{},qcgmnv,False,True,False,False,False,True,True,False,,"[{'e': 'text', 't': 'Student'}]",dark,richtext,False,False,False,0,0,False,all_ads,/r/cscareerquestions/comments/qcgmnv/college_coursesmath_curriculum_for_operations/,False,6,,1634781002,1,"So Im mapping out my career path as I am starting school and ever since doing an internship with a the FP&amp;A group that had a data science component, I really became interested in Operations Research (which was a team within data science at the company). I love the thought of process automation, complex problem solving, and efficiency improvement. 

However, not presently great at math.

Does any one have any guidance as to what level of **math** should be mastered before pursuing this career and what courses in particular should be a focus? 

Also, any suggestion for other courses not math related is welcome.",True,False,False,cscareerquestions,t5_2sdpm,625716,public,self,College Courses/Math Curriculum for Operations Research,0,[],1.0,https://www.reddit.com/r/cscareerquestions/comments/qcgmnv/college_coursesmath_curriculum_for_operations/,all_ads,6,,c9dd4bf2-b859-11e3-8535-12313d31e5b1,Student,,,,
[],False,williampathey,,[],,text,t2_az6qtc39,False,False,False,[],False,False,1634780937,self.cscareerquestions,https://www.reddit.com/r/cscareerquestions/comments/qcgm2h/vcpcma_2021_2v03121_dumps/,{},qcgm2h,False,False,False,False,False,False,True,False,,[],dark,text,False,False,True,0,0,False,all_ads,/r/cscareerquestions/comments/qcgm2h/vcpcma_2021_2v03121_dumps/,False,6,reddit,1634780948,1,[removed],True,False,False,cscareerquestions,t5_2sdpm,625715,public,self,VCP-CMA 2021 2V0-31.21 Dumps,0,[],1.0,https://www.reddit.com/r/cscareerquestions/comments/qcgm2h/vcpcma_2021_2v03121_dumps/,all_ads,6,,,,,,,
[],False,not-well55,,[],,text,t2_3u44n3tt,False,False,False,[],False,False,1634780503,self.cscareerquestions,https://www.reddit.com/r/cscareerquestions/comments/qcgh95/is_7_jobs_in_5_years_too_much_afraid_recruiters/,{},qcgh95,False,True,False,False,False,True,True,False,,[],dark,text,False,False,True,18,0,False,all_ads,/r/cscareerquestions/comments/qcgh95/is_7_jobs_in_5_years_too_much_afraid_recruiters/,False,6,,1634780514,1,"Graduated in spring of 2021, so just a few months ago.

I was very fortunate to get an internship my Sophomore year in 2017. This lead to me getting a co-op internship the semester after. Which lead to another semester long co-op else where. Which lead to a summer internship at a different company. Which lead to a part time internship during the school year with a different company. And finally, lead me to another full time summer + part time throughout the year internship. So before graduating I secured 6 internships, and was able to get a full time offer from another company before graduating. And I've been working here ever since (\~6 months). 

Out of the 6 internships I got return offers on 4 and think I did reasonably well. It was just life circumstances that made me not come back. The other 2 my performance could have been better, but based on the position and the state of the company they said they couldnt give me a (even a verbal) return offer.

a break down of my experience:

internship 1: 8 months all part time (got return offer)

internship2: 6 months full time (got return offer)

internship3: 4 months full time (got return offer)

internship4: 3 months full time (no return offer)

internship5:8 months part time (no return offer)

internship6: 11 months  full time + part time (got return offer)

full time job: 6 months and going

My current position is not exactly what I expected. They use dated terminology, but essentially I am a devops engineer. And I enjoy the work but I feel like im not getting challenged as much as I could. And I work IT in a large organization, and I would love to work for a tech company. I've been eyeing some openings at this other company, and an opening that describes what I want and where my skills align just became available. But im worried that i may come across as a job hopper if they were to look at my LinkedIn. I specify that it's an internship, but i'm worried HR would still red flag me. 

Would it be better to just stick it out with my current job to show that I can ,despite the potential opportunity cost of working somewhere else?

Essentially I want the recruiter to know that I can hold down a job, and it's not me getting pip'd or fired that's the cause for so many jobs on my resume.",True,False,False,cscareerquestions,t5_2sdpm,625705,public,self,Is 7 jobs in 5 years too much? Afraid recruiters think I can hold down a job,0,[],1.0,https://www.reddit.com/r/cscareerquestions/comments/qcgh95/is_7_jobs_in_5_years_too_much_afraid_recruiters/,all_ads,6,,,,,,,
