all_awardings,allow_live_comments,author,author_flair_css_class,author_flair_richtext,author_flair_text,author_flair_type,author_fullname,author_is_blocked,author_patreon_flair,author_premium,awarders,can_mod_post,contest_mode,created_utc,domain,full_link,gildings,id,is_created_from_ads_ui,is_crosspostable,is_meta,is_original_content,is_reddit_media_domain,is_robot_indexable,is_self,is_video,link_flair_background_color,link_flair_richtext,link_flair_text_color,link_flair_type,locked,media_only,no_follow,num_comments,num_crossposts,over_18,parent_whitelist_status,permalink,pinned,pwls,retrieved_on,score,selftext,send_replies,spoiler,stickied,subreddit,subreddit_id,subreddit_subscribers,subreddit_type,thumbnail,title,total_awards_received,treatment_tags,upvote_ratio,url,whitelist_status,wls,link_flair_template_id,link_flair_text,post_hint,preview,removed_by_category,author_flair_template_id,author_flair_text_color
[],False,aase_nomad,,[],,text,t2_dcg9cyif,False,False,False,[],False,False,1634676661,self.cscareerquestions,https://www.reddit.com/r/cscareerquestions/comments/qbkndd/linkedin_profile/,{},qbkndd,False,True,False,False,False,True,True,False,,[],dark,text,False,False,True,2,0,False,all_ads,/r/cscareerquestions/comments/qbkndd/linkedin_profile/,False,6,1634676672,1,"I’m just wondering what information are important to put on LinkedIn and what other information are not necessarily important?.


I saw some people just only list the companies name and some put all the role and responsibilities in the descriptions.

In recruiter perspective, what is important?. Do they even care?",True,False,False,cscareerquestions,t5_2sdpm,624603,public,self,LinkedIn profile,0,[],1.0,https://www.reddit.com/r/cscareerquestions/comments/qbkndd/linkedin_profile/,all_ads,6,,,,,,,
[],False,IApogee,,[],,text,t2_tjk0mr,False,False,False,[],False,False,1634676569,self.cscareerquestions,https://www.reddit.com/r/cscareerquestions/comments/qbkm7o/what_industrycompany_is_best_to_grow_career/,{},qbkm7o,False,True,False,False,False,True,True,False,,"[{'e': 'text', 't': 'New Grad'}]",dark,richtext,False,False,False,0,0,False,all_ads,/r/cscareerquestions/comments/qbkm7o/what_industrycompany_is_best_to_grow_career/,False,6,1634676580,1,"I am currently working at a big automotive company as a requirements analyst with the possibility to become a product manager in 3 years possibly. I received an offer from a big national bank to work as an Associate Product Manager with promotion to full PM in 2 years. The auto company is my first job and I will be here a year in a few months, however my goal is product management and I feel that the direct product management experience would be better, despite being at maybe a less technology focused company. The goal is Product Management in big tech down the road. The auto company is a fortune 20 company while the bank is fortune 100. Which would be best for my career, the company or the role?",True,False,False,cscareerquestions,t5_2sdpm,624601,public,self,What Industry/Company is best to grow career?,0,[],1.0,https://www.reddit.com/r/cscareerquestions/comments/qbkm7o/what_industrycompany_is_best_to_grow_career/,all_ads,6,05438160-1232-11e5-b573-0e1422b8b60b,New Grad,,,,,
[],False,DoughnutRare,,[],,text,t2_844tzx7x,False,False,False,[],False,False,1634676467,self.cscareerquestions,https://www.reddit.com/r/cscareerquestions/comments/qbkkv1/8_months_into_frontend_job_and_decided_i_want_to/,{},qbkkv1,False,True,False,False,False,True,True,False,,[],dark,text,False,False,True,2,0,False,all_ads,/r/cscareerquestions/comments/qbkkv1/8_months_into_frontend_job_and_decided_i_want_to/,False,6,1634676478,1,"After seeing what recent grads and Bootcamp grads are getting paid, and lots of financial stress myself, I've decided it's time to start looking for a new gig. Also because of shitty management at my current work, but mostly the money issue.

8 months ago i was hired as a frontend dev, making $60k. Before that, i co-founded a Saas company where we built a few web-based prototypes. Before that, i did a Masters in what is *kinda* a Saas accelerator (ideating, customer discovery, product-market-fit, designing, prototyping). Before that, I did a Bachelor's degree in Computer Science from a well-known university of where I'm from. I also have 12months of intern experience but we don't count that.

Thing is, I don't have any personal projects. I feel like a black sheep in this community, everyone and their grandmother seems to have a super impressive portfolio. I just haven't had time for it (or at least i tell myself), i've been consistently working long days for a few years now, and need the downtime in the evening.

So my question is, despite not having a portfolio, if I'm going to start applying to jobs in hopes of a better salary, should I just grind leetcode + submit applications or should i first build a couple of personal project apps ?",True,False,False,cscareerquestions,t5_2sdpm,624599,public,self,8 months into Frontend job and decided i want to leave. Create a portfolio or just start applying?,0,[],1.0,https://www.reddit.com/r/cscareerquestions/comments/qbkkv1/8_months_into_frontend_job_and_decided_i_want_to/,all_ads,6,,,,,,,
[],False,Myysticxx,,[],,text,t2_3wghicog,False,False,False,[],False,False,1634676178,self.cscareerquestions,https://www.reddit.com/r/cscareerquestions/comments/qbkhbq/online_coding_test_what_to_expect/,{},qbkhbq,False,True,False,False,False,True,True,False,,[],dark,text,False,False,True,1,0,False,all_ads,/r/cscareerquestions/comments/qbkhbq/online_coding_test_what_to_expect/,False,6,1634676189,1,"So I'm a fresh graduate looking for a software developer/engineer job and I've been emailed an online coding test, they said it should take roughly 65 minutes and has 3 tasks. Just don't want to blow it as its my first test so any tips or specifics I should look into before I do it?",True,False,False,cscareerquestions,t5_2sdpm,624597,public,self,Online Coding Test - What to expect.,0,[],1.0,https://www.reddit.com/r/cscareerquestions/comments/qbkhbq/online_coding_test_what_to_expect/,all_ads,6,,,,,,,
[],False,jalva624,,[],,text,t2_2qi72ljy,False,False,False,[],False,False,1634676163,self.cscareerquestions,https://www.reddit.com/r/cscareerquestions/comments/qbkh5e/upwork/,{},qbkh5e,False,True,False,False,False,True,True,False,,[],dark,text,False,False,True,0,0,False,all_ads,/r/cscareerquestions/comments/qbkh5e/upwork/,False,6,1634676174,1,Any of you guys have success with freelance?,True,False,False,cscareerquestions,t5_2sdpm,624596,public,self,Upwork,0,[],1.0,https://www.reddit.com/r/cscareerquestions/comments/qbkh5e/upwork/,all_ads,6,,,,,,,
[],False,SnafuInTheVoid,,[],,text,t2_1dmeaz7b,False,False,True,[],False,False,1634675884,self.cscareerquestions,https://www.reddit.com/r/cscareerquestions/comments/qbkdqt/first_interview_judge_my_hair_please/,{},qbkdqt,False,False,False,False,False,False,True,False,,"[{'e': 'text', 't': 'Student'}]",dark,richtext,False,False,True,2,0,False,all_ads,/r/cscareerquestions/comments/qbkdqt/first_interview_judge_my_hair_please/,False,6,1634675895,1,[removed],True,False,False,cscareerquestions,t5_2sdpm,624593,public,self,First interview - judge my HAIR please,0,[],1.0,https://www.reddit.com/r/cscareerquestions/comments/qbkdqt/first_interview_judge_my_hair_please/,all_ads,6,c9dd4bf2-b859-11e3-8535-12313d31e5b1,Student,self,"{'enabled': False, 'images': [{'id': 'ctv7IhHh3OHsZK4WmEiE41jYmmxGyFzYNHFkp5dSAws', 'resolutions': [{'height': 143, 'url': 'https://external-preview.redd.it/xVwxW5FjV0sXF_xvsPNilwsgWVUsa4XjbeMIJ0X9CIo.jpg?width=108&amp;crop=smart&amp;auto=webp&amp;s=e555212a170e7cd156af66934c2986f0d4d92692', 'width': 108}, {'height': 287, 'url': 'https://external-preview.redd.it/xVwxW5FjV0sXF_xvsPNilwsgWVUsa4XjbeMIJ0X9CIo.jpg?width=216&amp;crop=smart&amp;auto=webp&amp;s=16d05fda94053dfd1079ba4c379624f139754454', 'width': 216}, {'height': 426, 'url': 'https://external-preview.redd.it/xVwxW5FjV0sXF_xvsPNilwsgWVUsa4XjbeMIJ0X9CIo.jpg?width=320&amp;crop=smart&amp;auto=webp&amp;s=cf92e5be2114e24a06198c6c3794f05d262039b0', 'width': 320}, {'height': 853, 'url': 'https://external-preview.redd.it/xVwxW5FjV0sXF_xvsPNilwsgWVUsa4XjbeMIJ0X9CIo.jpg?width=640&amp;crop=smart&amp;auto=webp&amp;s=c7c44568780bd367661bc6c35ad039fac96c9060', 'width': 640}], 'source': {'height': 853, 'url': 'https://external-preview.redd.it/xVwxW5FjV0sXF_xvsPNilwsgWVUsa4XjbeMIJ0X9CIo.jpg?auto=webp&amp;s=942192743c70b70cde43b5acfb5902642af4615d', 'width': 640}, 'variants': {}}]}",moderator,,
[],False,Venusgoyard,,[],,text,t2_a3x0idod,False,False,False,[],False,False,1634675170,self.cscareerquestions,https://www.reddit.com/r/cscareerquestions/comments/qbk51t/bootcamp_or_master_of_science/,{},qbk51t,False,True,False,False,False,True,True,False,,[],dark,text,False,False,True,7,0,False,all_ads,/r/cscareerquestions/comments/qbk51t/bootcamp_or_master_of_science/,False,6,1634675180,1,"I'm currently a senior undergraduate student at The New School. My major is in economics, and my minor is creative coding. I have some basic knowledge in Python and R and only have recently discovered my interest in CS. My university combines a design school and a liberal arts college, so my economics degree is theory-based and socialist-leaning. 

I feel like I'm in the wrong program, but I do have a scholarship, so I plan on graduating as soon as possible with my undergrad. I have a decent GPA of 3.65. I'm also not a US citizen and am on an F1 visa here. This citizenship situation, plus a not-so prestigious education background, make it difficult for me to seek post-graduate employment here in the US. My peers from NYU and Columbia are landing jobs at significant investment banks here and there; so far, I've heard nothing back from around 50 applications of internships I've applied so far. 

Now I have a couple of choices; one is to return to China and seek international economics/ finance-related jobs, but I want to pursue further education. One of my friends with an average undergrad degree but attended Columbia's Fintech program landed an excellent job at Citibank. My interests and knowledge lie closer to data science and machine learning, and I'm contemplating doing the data science BootCamp there. I also thought perhaps I should do a master's program in computer science. I also saw an online program at UC Berkeley specific in data science, which means I can attend from China while working a job. I don't have any student loans for my undergraduate, but I will be taking one out if I pursue a master's. What would you do if you were in my position?",True,False,False,cscareerquestions,t5_2sdpm,624589,public,self,Bootcamp or Master of science?,0,[],1.0,https://www.reddit.com/r/cscareerquestions/comments/qbk51t/bootcamp_or_master_of_science/,all_ads,6,,,,,,,
[],False,larenspear,,[],,text,t2_22i0yils,False,False,False,[],False,False,1634674501,self.cscareerquestions,https://www.reddit.com/r/cscareerquestions/comments/qbjwk7/no_second_round_interviews_for_summer_2022/,{},qbjwk7,False,False,False,False,False,False,True,False,,[],dark,text,False,False,True,2,0,False,all_ads,/r/cscareerquestions/comments/qbjwk7/no_second_round_interviews_for_summer_2022/,False,6,1634674512,1,[removed],True,False,False,cscareerquestions,t5_2sdpm,624591,public,self,"No second round interviews for Summer 2022 internships by now, should I be worried?",0,[],1.0,https://www.reddit.com/r/cscareerquestions/comments/qbjwk7/no_second_round_interviews_for_summer_2022/,all_ads,6,,,,,moderator,,
[],False,americanista915,,[],,text,t2_eiqaazuk,False,False,False,[],False,False,1634674265,self.cscareerquestions,https://www.reddit.com/r/cscareerquestions/comments/qbjtkg/i_nterviewed_at_a_major_company_today_and_was/,{},qbjtkg,False,True,False,False,False,True,True,False,,[],dark,text,False,False,True,6,0,False,all_ads,/r/cscareerquestions/comments/qbjtkg/i_nterviewed_at_a_major_company_today_and_was/,False,6,1634674277,1,"So full disclosure I already work &amp; don’t necessarily need the job but definitely want the bigger money and I was surprised I didn’t have to do a code test. I’ve done internships at 10 people teams that required it but this place employees over 50,000 people and BOOM no code test. 


I find it odd that arguably the biggest brightest tech company in the world doesn’t require a code test. Is this a thing now did they stop using code test as much or is this just like a one off thing?",True,False,False,cscareerquestions,t5_2sdpm,624586,public,self,I !nterviewed at a major company today and was rather shocked,0,[],1.0,https://www.reddit.com/r/cscareerquestions/comments/qbjtkg/i_nterviewed_at_a_major_company_today_and_was/,all_ads,6,,,,,,,
[],False,polar_the_princess,,[],,text,t2_727htwts,False,False,False,[],False,False,1634673806,self.cscareerquestions,https://www.reddit.com/r/cscareerquestions/comments/qbjnkm/morgan_stanley_2022_tech_analyst_hirevue_fulltime/,{},qbjnkm,False,False,False,False,False,False,True,False,,[],dark,text,False,False,True,2,0,False,all_ads,/r/cscareerquestions/comments/qbjnkm/morgan_stanley_2022_tech_analyst_hirevue_fulltime/,False,6,1634673817,1,[removed],True,False,False,cscareerquestions,t5_2sdpm,624584,public,self,Morgan Stanley 2022 Tech Analyst Hirevue (Full-Time),0,[],1.0,https://www.reddit.com/r/cscareerquestions/comments/qbjnkm/morgan_stanley_2022_tech_analyst_hirevue_fulltime/,all_ads,6,,,,,moderator,,
[],False,polar_the_princess,,[],,text,t2_727htwts,False,False,False,[],False,False,1634673757,self.cscareerquestions,https://www.reddit.com/r/cscareerquestions/comments/qbjmyz/morgan_stanley_2022_tech_analyst_hirevue_fulltime/,{},qbjmyz,False,False,False,False,False,False,True,False,,"[{'e': 'text', 't': 'Student'}]",dark,richtext,False,False,True,2,0,False,all_ads,/r/cscareerquestions/comments/qbjmyz/morgan_stanley_2022_tech_analyst_hirevue_fulltime/,False,6,1634673769,1,[removed],True,False,False,cscareerquestions,t5_2sdpm,624584,public,self,Morgan Stanley 2022 Tech Analyst Hirevue (Full-Time),0,[],1.0,https://www.reddit.com/r/cscareerquestions/comments/qbjmyz/morgan_stanley_2022_tech_analyst_hirevue_fulltime/,all_ads,6,c9dd4bf2-b859-11e3-8535-12313d31e5b1,Student,,,moderator,,
[],False,csmajorthrowaway1,,[],,text,t2_fnno3y0r,False,False,False,[],False,False,1634673703,self.cscareerquestions,https://www.reddit.com/r/cscareerquestions/comments/qbjm83/advice_on_goldman_tech_analyst_vs_fb_swe_intern/,{},qbjm83,False,False,False,False,False,False,True,False,,"[{'e': 'text', 't': 'Student'}]",dark,richtext,False,False,True,2,0,False,all_ads,/r/cscareerquestions/comments/qbjm83/advice_on_goldman_tech_analyst_vs_fb_swe_intern/,False,6,1634673714,1,[removed],True,False,False,cscareerquestions,t5_2sdpm,624584,public,self,Advice on Goldman Tech Analyst vs. FB SWE Intern,0,[],1.0,https://www.reddit.com/r/cscareerquestions/comments/qbjm83/advice_on_goldman_tech_analyst_vs_fb_swe_intern/,all_ads,6,c9dd4bf2-b859-11e3-8535-12313d31e5b1,Student,,,moderator,,
[],False,Similar_Storm_981,,[],,text,t2_6a1pf5zx,False,False,False,[],False,False,1634673379,self.cscareerquestions,https://www.reddit.com/r/cscareerquestions/comments/qbjhqv/capital_one_tdp_intern_to_tdp_fulltime_location/,{},qbjhqv,False,True,False,False,False,True,True,False,,[],dark,text,False,False,True,1,0,False,all_ads,/r/cscareerquestions/comments/qbjhqv/capital_one_tdp_intern_to_tdp_fulltime_location/,False,6,1634673390,1,"I recently received an offer for Capital One’s TDP internship in the Chicago office. Location is really important to me and I would like to be in Chicago full-time after graduation. I have heard that return offer locations are based on the location that you interned in, but also heard that full-time location placement can be pretty random.

Can any former TDP interns who received return offers speak on how likely it is to get desired full-time location, specifically Chicago if I were to intern there and get return offer?

Thanks in advance!",True,False,False,cscareerquestions,t5_2sdpm,624576,public,self,Capital One TDP intern to TDP full-time location,0,[],1.0,https://www.reddit.com/r/cscareerquestions/comments/qbjhqv/capital_one_tdp_intern_to_tdp_fulltime_location/,all_ads,6,,,,,,,
[],False,khal2201,,[],,text,t2_5s936kej,False,False,False,[],False,False,1634672930,self.cscareerquestions,https://www.reddit.com/r/cscareerquestions/comments/qbjc0f/should_i_drop_my_cse_program/,{},qbjc0f,False,True,False,False,False,True,True,False,,"[{'e': 'text', 't': 'Student'}]",dark,richtext,False,False,True,3,0,False,all_ads,/r/cscareerquestions/comments/qbjc0f/should_i_drop_my_cse_program/,False,6,1634672942,1,"Hello everyone, so I’m in my first year of my CSE program and so far we haven’t even written any code. We’ve been doing binary and algorithms along with pseudo code, things like that. We haven’t actually created anything yet but I’m still extremely stressed out due to Calculus and chemistry along with the computer science class. I’m not doing that well in it and I just don’t know if I’ll really enjoy doing it for years to come. My biggest thing or fear is CSE is such a lucrative degree path that I just don’t know if I can really find with any other degree so that’s my biggest fear really. I haven’t attended any of the hackathons that have been going on due to me just not really being interested in them even though I know they’re important. Any advice? Idk if it’s the math that’s messing me up since I’ve always been not so great at Math or if it’s the fear of just coding all day and not talking to anyone. I don’t know, any advice would be appreciated. Like I said, my biggest fear is the money.",True,False,False,cscareerquestions,t5_2sdpm,624573,public,self,Should I drop my CSE program,0,[],1.0,https://www.reddit.com/r/cscareerquestions/comments/qbjc0f/should_i_drop_my_cse_program/,all_ads,6,c9dd4bf2-b859-11e3-8535-12313d31e5b1,Student,,,,,
[],False,GamifiedLifestyle,,[],,text,t2_8pvx86k4,False,False,False,[],False,False,1634672833,self.cscareerquestions,https://www.reddit.com/r/cscareerquestions/comments/qbjaq9/tcpip_illustrated_volume_1_question/,{},qbjaq9,False,True,False,False,False,True,True,False,,[],dark,text,False,False,True,1,0,False,all_ads,/r/cscareerquestions/comments/qbjaq9/tcpip_illustrated_volume_1_question/,False,6,1634672843,1,"For anyone who's read this book, does it teach you the fundamentals of networking (routing / switching, subnetting and how to subnet, NAT, etc)?",True,False,False,cscareerquestions,t5_2sdpm,624573,public,self,"TCP/IP Illustrated, Volume 1 question.",0,[],1.0,https://www.reddit.com/r/cscareerquestions/comments/qbjaq9/tcpip_illustrated_volume_1_question/,all_ads,6,,,,,,,
[],False,TheMightyGlocktopus,,[],,text,t2_4ppjietx,False,False,False,[],False,False,1634672795,self.cscareerquestions,https://www.reddit.com/r/cscareerquestions/comments/qbja7u/my_boss_says_regularly_that_he_wishes_id_work_as/,{},qbja7u,False,True,False,False,False,True,True,False,,"[{'e': 'text', 't': 'Student'}]",dark,richtext,False,False,True,12,0,False,all_ads,/r/cscareerquestions/comments/qbja7u/my_boss_says_regularly_that_he_wishes_id_work_as/,False,6,1634672806,1,"Sorry for any spelling errors, English is not my first language and I'm kind of rusty.

So I've been working for this startup for eight months or so and I'm graduating this semester, in february. We are a team of 4 programmers, and I am currently the only frontend guy there since our fullstack developer moved to a bigger company.

My problem is that my boss has been making some snarky comments on how he does not want me to become fully employed, since I do 6-7 hours of work daily with barely more than minimum wage, and he has recently shared with us that our investors want to expand our developer team. Because of this, I am afraid that, when I graduate and ask for a full time position, I'd be denied of it, which sucks since I'm planning on moving out of my parents' house next year and really need the extra cash a full time position provides.

My question is: should I worry about that and search for new opportunities or am I just exagerating? Should I talk to my boss about my future in the company?

Thanks in advance",True,False,False,cscareerquestions,t5_2sdpm,624573,public,self,My boss says regularly that he wishes I'd work as an intern as long as possible,0,[],1.0,https://www.reddit.com/r/cscareerquestions/comments/qbja7u/my_boss_says_regularly_that_he_wishes_id_work_as/,all_ads,6,c9dd4bf2-b859-11e3-8535-12313d31e5b1,Student,,,,,
[],False,jonathanIckovich,,[],,text,t2_ekxqwox1,False,False,False,[],False,False,1634672624,self.cscareerquestions,https://www.reddit.com/r/cscareerquestions/comments/qbj7w0/im_in_a_code_platform_hell_and_need_advice_on_how/,{},qbj7w0,False,True,False,False,False,True,True,False,,[],dark,text,False,False,True,3,0,False,all_ads,/r/cscareerquestions/comments/qbj7w0/im_in_a_code_platform_hell_and_need_advice_on_how/,False,6,1634672635,1,I need to use Netbeans as a coding platform but ran into a [bug.Im](https://bug.Im) also using a recommended VM an instructor recommended and Netbeans doesn't work there [either.I'm](https://either.im) at a point where I cant code and wI'masting my days. what platform is the most user-friendly for global java web applications?,True,False,False,cscareerquestions,t5_2sdpm,624573,public,self,im in a code platform hell and need advice on how to get out.,0,[],1.0,https://www.reddit.com/r/cscareerquestions/comments/qbj7w0/im_in_a_code_platform_hell_and_need_advice_on_how/,all_ads,6,,,,,,,
[],False,sirius_b1ack,,[],,text,t2_284246ca,False,False,False,[],False,False,1634672394,self.cscareerquestions,https://www.reddit.com/r/cscareerquestions/comments/qbj4zz/how_to_overcome_impostor_cycle_i_feel_like_im/,{},qbj4zz,False,True,False,False,False,True,True,False,,[],dark,text,False,False,True,3,0,False,all_ads,/r/cscareerquestions/comments/qbj4zz/how_to_overcome_impostor_cycle_i_feel_like_im/,False,6,1634672405,1,"I'm backend engineer with 6 YOE, I joined my current company around 3 years ago. On my second year I gotten PIP mainly because my task output was low. (I'm also not very good at talking about my task, yes I got stuck but didn't ask for help), after that I did feel like I improved. However, I recently got moved to a frontend team, which is a totally new tech stack for me. Since PIP, I'm always anxious, now with the new stack I'm worried that I'm not able to deliver as fast as others. I'm also a bit upset that I still haven't gotten a promotion (come to think of it, my manager changed 3 times). I kinda have a bad start with the new manager for missing the target date for a really small task (my bad, I did slack a bit)

I'd like to ask for some advice, is it normal that to Still be afraid of asking for help? I keep comparing myself to others who join after me and got promoted quicker. I feel like I'm slowly losing my passion, don't get me wrong I love coding and tech. But I'm starting to hate Mondays, and I think this is a bad combination. I don't hate my team, I still feel like I'm able to learn a lot. I always feel like I'm useless in the team.",False,False,False,cscareerquestions,t5_2sdpm,624568,public,self,"How to overcome impostor ""cycle""? I feel like I'm always anxious",0,[],1.0,https://www.reddit.com/r/cscareerquestions/comments/qbj4zz/how_to_overcome_impostor_cycle_i_feel_like_im/,all_ads,6,,,,,,,
[],False,Spycii,,[],,text,t2_13pmno,False,False,False,[],False,False,1634671946,self.cscareerquestions,https://www.reddit.com/r/cscareerquestions/comments/qbize6/how_long_did_it_take_you_to_consistently_get_good/,{},qbize6,False,True,False,False,False,True,True,False,,[],dark,text,False,False,False,1,0,False,all_ads,/r/cscareerquestions/comments/qbize6/how_long_did_it_take_you_to_consistently_get_good/,False,6,1634671957,1,"Title. I know it varies depending on how good your data structures and algorithms class is, if you paid attention or not etc. but how long did it take you?",True,False,False,cscareerquestions,t5_2sdpm,624565,public,self,How long did it take you to consistently get good at solving leetcode mediums?,0,[],1.0,https://www.reddit.com/r/cscareerquestions/comments/qbize6/how_long_did_it_take_you_to_consistently_get_good/,all_ads,6,,,,,,,
[],False,yofluffyjammies,,[],,text,t2_ov9td,False,False,False,[],False,False,1634671587,self.cscareerquestions,https://www.reddit.com/r/cscareerquestions/comments/qbiuma/do_you_fail_less_nterviews_as_you_progress_in/,{},qbiuma,False,True,False,False,False,True,True,False,,"[{'e': 'text', 't': 'Experienced'}]",dark,richtext,False,False,True,7,0,False,all_ads,/r/cscareerquestions/comments/qbiuma/do_you_fail_less_nterviews_as_you_progress_in/,False,6,1634671598,1,"I'm curious about other people's experience. Personally, I failed a lot of interviews as a new grad getting my first job (i.e. lack of work experience, not much experience doing coding interviews, etc). I failed less interviews getting my second job (pretty much passed each technical round). Now looking for my third job, I feel like I am failing my interviews again, even though I have more valuable work experience and my coding (Leetcode and actual job coding) skills is the same, if not better, than my last job.   


So I just want to ask, do people tend to fail less and less interviews as time goes on?",True,False,False,cscareerquestions,t5_2sdpm,624562,public,self,Do you fail less !nterviews as you progress in your career?,0,[],1.0,https://www.reddit.com/r/cscareerquestions/comments/qbiuma/do_you_fail_less_nterviews_as_you_progress_in/,all_ads,6,0968d7a4-1232-11e5-a323-0e1422b8b60b,Experienced,,,,,
