all_awardings,allow_live_comments,author,author_flair_css_class,author_flair_richtext,author_flair_text,author_flair_type,author_fullname,author_is_blocked,author_patreon_flair,author_premium,awarders,can_mod_post,contest_mode,created_utc,domain,full_link,gildings,id,is_created_from_ads_ui,is_crosspostable,is_meta,is_original_content,is_reddit_media_domain,is_robot_indexable,is_self,is_video,link_flair_background_color,link_flair_richtext,link_flair_text_color,link_flair_type,locked,media_only,no_follow,num_comments,num_crossposts,over_18,parent_whitelist_status,permalink,pinned,pwls,retrieved_on,score,selftext,send_replies,spoiler,stickied,subreddit,subreddit_id,subreddit_subscribers,subreddit_type,thumbnail,title,total_awards_received,treatment_tags,upvote_ratio,url,whitelist_status,wls,link_flair_template_id,link_flair_text,post_hint,preview,removed_by_category,author_flair_template_id,author_flair_text_color
[],False,jae_young,,[],,text,t2_si542,False,False,False,[],False,False,1634671568,self.cscareerquestions,https://www.reddit.com/r/cscareerquestions/comments/qbiubu/should_i_send_a_follow_up_email/,{},qbiubu,False,True,False,False,False,True,True,False,,"[{'e': 'text', 't': 'Experienced'}]",dark,richtext,False,False,True,0,0,False,all_ads,/r/cscareerquestions/comments/qbiubu/should_i_send_a_follow_up_email/,False,6,1634671580,1,"Had an initial video screen with the head of engineering. I was left with the impression that it went really well considering how they went from being very stoic to laughing by the end of the call. I was explained about their interview process (next steps being a take-home challenge from some repo) and that I would be hearing back from their recruiter (the person who first set up this video call). I had this call at the end of this past Friday so I figured I would be followed up on Monday. Two business days later - still no email. Usually wouldn't think much but from my experience, the first to second stage in an interview was always immediate and didn't have much gap... 

Should I follow up with their recruiter who originally reached out and set the first video call and if I should, what should I say?",True,False,False,cscareerquestions,t5_2sdpm,624561,public,self,Should I send a follow up email?,0,[],1.0,https://www.reddit.com/r/cscareerquestions/comments/qbiubu/should_i_send_a_follow_up_email/,all_ads,6,0968d7a4-1232-11e5-a323-0e1422b8b60b,Experienced,,,,,
[],False,SimpleRandomWalk,,[],,text,t2_2g7fzfnk,False,False,False,[],False,False,1634671526,self.cscareerquestions,https://www.reddit.com/r/cscareerquestions/comments/qbitsp/is_a_minor_enough/,{},qbitsp,False,True,False,False,False,True,True,False,,[],dark,text,False,False,True,0,0,False,all_ads,/r/cscareerquestions/comments/qbitsp/is_a_minor_enough/,False,6,1634671537,1,"I am an undergrad majoring in a degree from the business school (Econ), would a CS minor and a few personal projects be enough to apply for swe? 

Another thing is I did not do any internships because I was focused very heavily on something else during the summer, how much of an impact will this have on full time applications?",True,False,False,cscareerquestions,t5_2sdpm,624561,public,self,Is a minor enough?,0,[],1.0,https://www.reddit.com/r/cscareerquestions/comments/qbitsp/is_a_minor_enough/,all_ads,6,,,,,,,
[],False,OmerStockAccount,,[],,text,t2_8ie4bvxi,False,False,False,[],False,False,1634671408,self.cscareerquestions,https://www.reddit.com/r/cscareerquestions/comments/qbisb4/getting_into_the_software_industry_with_an_econ/,{},qbisb4,False,True,False,False,False,True,True,False,,"[{'e': 'text', 't': 'Student'}]",dark,richtext,False,False,True,5,0,False,all_ads,/r/cscareerquestions/comments/qbisb4/getting_into_the_software_industry_with_an_econ/,False,6,1634671419,1,"**My situation:**
Next year I’ll be going to university to study Economics. I’ve recently had a change of heart and want to work as a software developer. To put it simply, the uni system in my country just doesn’t make it feasible for me to convert my uni application from econ to CS. However there is a good chance I can convert to a mathematics course. I am very good at coding, been doing it for 8 years out of interest. It is possible for me to do a masters in CS after my undergrad degree in econ.

**My question:**
1) Do employers care about your degree? Is it worth me changing to mathematics?
2) Is a mathematics/econ degree sufficient to be considered by employers (I ask this because the technical interviews are not a concern for me)?
3) Should I do a masters in CS to make up for my non-relevant academic background?

I live in the UK, the application process for software jobs is exact same as in the US.

Any help is appreciated :D",True,False,False,cscareerquestions,t5_2sdpm,624560,public,self,Getting into the software industry with an Econ degree,0,[],1.0,https://www.reddit.com/r/cscareerquestions/comments/qbisb4/getting_into_the_software_industry_with_an_econ/,all_ads,6,c9dd4bf2-b859-11e3-8535-12313d31e5b1,Student,,,,,
[],False,Vagabond_Tea,,[],,text,t2_130z5c,False,False,False,[],False,False,1634671270,self.cscareerquestions,https://www.reddit.com/r/cscareerquestions/comments/qbiqi9/any_witch_companies_that_actually_pay_training/,{},qbiqi9,False,True,False,False,False,True,True,False,,[],dark,text,False,False,True,4,0,False,all_ads,/r/cscareerquestions/comments/qbiqi9/any_witch_companies_that_actually_pay_training/,False,6,1634671281,1,"Seems like the consensus is companies like Revature are objectively worse than even WITCH companies. But their hook is that they provide training to people that have zero skills in tech, let alone experience, and jobs (in theory). Are there literally any other company that even approaches this though? Take people with zero coding skills and make them programmers in-house? Just curious",True,False,False,cscareerquestions,t5_2sdpm,624557,public,self,Any WITCH companies that actually pay training for those that don't have any experience or tech skills at all?,0,[],1.0,https://www.reddit.com/r/cscareerquestions/comments/qbiqi9/any_witch_companies_that_actually_pay_training/,all_ads,6,,,,,,,
[],False,genericCSQuestions,,[],,text,t2_8l64n101,False,False,False,[],False,False,1634671243,self.cscareerquestions,https://www.reddit.com/r/cscareerquestions/comments/qbiq6b/cognixia_citibank_scam/,{},qbiq6b,False,True,False,False,False,True,True,False,,[],dark,text,False,False,True,3,0,False,all_ads,/r/cscareerquestions/comments/qbiq6b/cognixia_citibank_scam/,False,6,1634671254,1," Hi, I recently went through the interviews with Cognixia and have the the chance to start their training program. After the training program, they specifically said I will be placed with Citibank as an Android developer with a 50k salary completely remote. The fee for the training is a 1 time payment of $100.

Should I take this, or is this a scam?",True,False,False,cscareerquestions,t5_2sdpm,624557,public,self,Cognixia Citibank Scam?,0,[],1.0,https://www.reddit.com/r/cscareerquestions/comments/qbiq6b/cognixia_citibank_scam/,all_ads,6,,,,,,,
[],False,GameMaster0097,,[],,text,t2_tso9d0p,False,False,False,[],False,False,1634671066,self.cscareerquestions,https://www.reddit.com/r/cscareerquestions/comments/qbio1k/cognixia_citibank_scam/,{},qbio1k,False,True,False,False,False,True,True,False,,[],dark,text,False,False,False,0,0,False,all_ads,/r/cscareerquestions/comments/qbio1k/cognixia_citibank_scam/,False,6,1634671077,1,"Hi, I recently went through the interviews with Cognixia and have the the chance to start their training program. After the training program, they specifically said I will be placed with Citibank as an Android developer with a 50k salary completely remote. The fee for the training is a 1 time payment of $100.

Should I take this, or is this a scam?",True,False,False,cscareerquestions,t5_2sdpm,624555,public,self,Cognixia Citibank Scam?,0,[],1.0,https://www.reddit.com/r/cscareerquestions/comments/qbio1k/cognixia_citibank_scam/,all_ads,6,,,,,,,
[],False,Kroren,,[],,text,t2_zas8u,False,False,False,[],False,False,1634671014,self.cscareerquestions,https://www.reddit.com/r/cscareerquestions/comments/qbined/frontend_developers_are_there_any_skills_you_wish/,{},qbined,False,True,False,False,False,True,True,False,,"[{'e': 'text', 't': 'New Grad'}]",dark,richtext,False,False,True,5,0,False,all_ads,/r/cscareerquestions/comments/qbined/frontend_developers_are_there_any_skills_you_wish/,False,6,1634671026,1,"I've been doing a lot of interviews lately and it seems very likely I'm going to be working as a Front-end web developer out of college and I'm very excited as its a field I'm very interested in!    


To any current or former front-end developers, are there any skills you wish you had studied further before going into your position?  I did pretty well on a technical interview regarding JS frameworks, but I still feel like I'm very underprepared.  I still have some time before my December graduation to fill in any blanks before I start work in 2022.  What sort of skills are worth studying beyond the typical HTML/CSS/JS frameworks and design ideas.",True,False,False,cscareerquestions,t5_2sdpm,624555,public,self,Front-end developers: Are there any skills you wish you knew going into your career?,0,[],1.0,https://www.reddit.com/r/cscareerquestions/comments/qbined/frontend_developers_are_there_any_skills_you_wish/,all_ads,6,05438160-1232-11e5-b573-0e1422b8b60b,New Grad,,,,,
[],False,RingWormGuard,,[],,text,t2_4gns7chi,False,False,False,[],False,False,1634670302,self.cscareerquestions,https://www.reddit.com/r/cscareerquestions/comments/qbiehv/would_it_be_worth_to_take_the_pay_cut/,{},qbiehv,False,True,False,False,False,True,True,False,,"[{'e': 'text', 't': 'Experienced'}]",dark,richtext,False,False,True,4,0,False,all_ads,/r/cscareerquestions/comments/qbiehv/would_it_be_worth_to_take_the_pay_cut/,False,6,1634670313,1,"I'm a full stack (mostly front) dev with 2 YOE and recently I got reached out for this job at a big big company (I think the biggest IT company in my continent).

They told me they were looking for someone with more experience in the back end, which is fair. I've done mostly Front End throughout my career. However they offered me to interview for another position, but it's a bit too Jr and they already told me it'd come with less salary than what I asked for, but we haven't settled in any number 

Currently I'm working as a FE developer using react, but I don't really learn much more than what I already knew before joining, besides maybe a library or two. Tbh the working standards are not the highest, we don't even do unit testing so I feel like I'm not in a place to grow that much. (yeah yeah, I know I could push to start improving the quality, I'm working on it) 

So here I am, trying to decide whether to take the job offer and start working in this massive company with highly complex systems and millions of users or, stay where I am, get paid a more and obviously keep learning as I go.

Do you think in the long run it'd be significantly better to work in an environment like this new offer with millions of users and complex systems or should I just stay where I am and make more money?",True,False,False,cscareerquestions,t5_2sdpm,624550,public,self,Would it be worth to take the pay cut?,0,[],1.0,https://www.reddit.com/r/cscareerquestions/comments/qbiehv/would_it_be_worth_to_take_the_pay_cut/,all_ads,6,0968d7a4-1232-11e5-a323-0e1422b8b60b,Experienced,,,,,
[],False,Corrade1,,[],,text,t2_4cujnm9p,False,False,False,[],False,False,1634670085,self.cscareerquestions,https://www.reddit.com/r/cscareerquestions/comments/qbibok/infosys_threatening_to_terminate_me_for/,{},qbibok,False,True,False,False,False,True,True,False,,[],dark,text,False,False,True,7,0,False,all_ads,/r/cscareerquestions/comments/qbibok/infosys_threatening_to_terminate_me_for/,False,6,1634670096,1,As the title says. So basically I asked my client manager to be put onto the bench because not like the project that I was put on. So my manager’s manager wanted to put me on a different project with the same client. But I asked to be put on the bench to look for a different project/client. They were obviously not happy so they took it to hr and now they want to terminate me for requesting to be put on bench. I’ve heard and known some people that were successfully put back on the bench of different reasons including my reason. Not sure why they are really hesitant to put me back on bench and they would rather terminate me. What should I do? Keep on insisting to be on bench? Or just terminate/quit?,True,False,False,cscareerquestions,t5_2sdpm,624551,public,self,Infosys threatening to terminate me for requesting to be on bench,0,[],1.0,https://www.reddit.com/r/cscareerquestions/comments/qbibok/infosys_threatening_to_terminate_me_for/,all_ads,6,,,,,,,
[],False,GrandKnightMaster,,[],,text,t2_eo5dhbwm,False,False,False,[],False,False,1634669609,self.cscareerquestions,https://www.reddit.com/r/cscareerquestions/comments/qbi5mw/noncoding_jobs_available_for_computer_science/,{},qbi5mw,False,True,False,False,False,True,True,False,,[],dark,text,False,False,True,4,0,False,all_ads,/r/cscareerquestions/comments/qbi5mw/noncoding_jobs_available_for_computer_science/,False,6,1634669620,1,"What are some of the non-coding jobs that a computer science degree holder/major can apply for? 

If you want to move away from a standard programming/coding job in a software development role, to another non-coding/computer science/tech/IT-related job. What should you be looking at? 

I just wanted to see a list of jobs non-technical (non-coding) jobs a computer science degree holder can apply to.",True,False,False,cscareerquestions,t5_2sdpm,624543,public,self,Non-coding jobs available for Computer Science majors?,0,[],1.0,https://www.reddit.com/r/cscareerquestions/comments/qbi5mw/noncoding_jobs_available_for_computer_science/,all_ads,6,,,,,,,
[],False,safari-al,,[],,text,t2_3klrpgso,False,False,False,[],False,False,1634669312,self.cscareerquestions,https://www.reddit.com/r/cscareerquestions/comments/qbi1wp/is_codesignal_something_worth_grinding_if_youre/,{},qbi1wp,False,True,False,False,False,True,True,False,,[],dark,text,False,False,True,0,0,False,all_ads,/r/cscareerquestions/comments/qbi1wp/is_codesignal_something_worth_grinding_if_youre/,False,6,1634669323,1,"Hi everyone: 

I'm frustrated as I had a codesignal with MC questions and I didn't anticipate that. Without sounding bitter, I felt like the MC's were standardized test-style 'gotcha' questions that really have no bearing in real world development. I was told that I was one MC away from going forward. This is a source of anxiety for me since I don't want to have to get good at answering artificial MC questions while managing my job hunt with other applications. Does anyone use/subsribe to codesignal? is it worth it and has it helped you?",True,False,False,cscareerquestions,t5_2sdpm,624541,public,self,is Codesignal something worth grinding if you're already on LC?,0,[],1.0,https://www.reddit.com/r/cscareerquestions/comments/qbi1wp/is_codesignal_something_worth_grinding_if_youre/,all_ads,6,,,,,,,
[],False,Henry_the_henhen,,[],,text,t2_3zrgvmjg,False,False,False,[],False,False,1634669226,self.cscareerquestions,https://www.reddit.com/r/cscareerquestions/comments/qbi0sm/what_to_do_after_oa/,{},qbi0sm,False,True,False,False,False,True,True,False,,"[{'e': 'text', 't': 'Student'}]",dark,richtext,False,False,True,2,0,False,all_ads,/r/cscareerquestions/comments/qbi0sm/what_to_do_after_oa/,False,6,1634669237,1,I've finished Ebay's OA with 837/850 but I still haven't heard back after a month. Should I contact the recruiters to let them know that I am still interested or is it basically over and I should just forget about eBay?,True,False,False,cscareerquestions,t5_2sdpm,624540,public,self,What to do after OA,0,[],1.0,https://www.reddit.com/r/cscareerquestions/comments/qbi0sm/what_to_do_after_oa/,all_ads,6,c9dd4bf2-b859-11e3-8535-12313d31e5b1,Student,,,,,
[],False,steven_lasagna,,[],,text,t2_1ktjtwt9,False,False,False,[],False,False,1634669079,self.cscareerquestions,https://www.reddit.com/r/cscareerquestions/comments/qbhz0k/need_tips_for_self_evaluation_questions/,{},qbhz0k,False,True,False,False,False,True,True,False,,[],dark,text,False,False,True,0,0,False,all_ads,/r/cscareerquestions/comments/qbhz0k/need_tips_for_self_evaluation_questions/,False,6,1634669091,1,"I need to fill self evaluation form once every year with he usual questions: what are your achievements in the last year? what can you improve on? what are your goals?

the problem is I have no idea how to fill the first and third questions.
for the first ine, I always end up thinking I completed these two projects, but they took almost double the expected time and I dont think that was good.
the problem with three is I don't have any idea what I want to do next. All I can think of is keep giving me interesting problems to solve.

any tips?",True,False,False,cscareerquestions,t5_2sdpm,624537,public,self,Need tips for self evaluation questions,0,[],1.0,https://www.reddit.com/r/cscareerquestions/comments/qbhz0k/need_tips_for_self_evaluation_questions/,all_ads,6,,,,,,,
[],False,MuffinManWizard,,"[{'e': 'text', 't': 'Looking for job'}]",Looking for job,richtext,t2_hmask,False,False,False,[],False,False,1634669045,self.cscareerquestions,https://www.reddit.com/r/cscareerquestions/comments/qbhylw/am_i_crazy_or_does_revature_seem_like_a_great/,{},qbhylw,False,True,False,False,False,True,True,False,,[],dark,text,False,False,True,67,0,False,all_ads,/r/cscareerquestions/comments/qbhylw/am_i_crazy_or_does_revature_seem_like_a_great/,False,6,1634669056,1,"\*\*Am I crazy or does Revature seem like a great option?\*\*  

&amp;#x200B;

Hi r/cscareerquestions. First time, long time!  

  

Background:  

\-I am 25 years old.  

\-No kids, no wife, no nothing.  

\-No tech background whatsoever. My past career highlights include managing a Subway restaurant for 12$ an hour, and digging ditches for 450$ a week.  

\-My parents are dead and I’ve been pity mooching off some extended family for the last few years.  

\-At year’s end I will have an A.S. in Computer Programming and Analysis. \*(the difference between an A.S. and an A.A. at least in my college is that an A.S. cuts out half the general education requirements and focuses more on technical classes)\*  

  .  

  .  

I’m certainly not a beginner in regards to programming, but I’m nowhere near a professional level at the moment. C# and Java, object orientated languages are my favorite because I feel like I understand them the most.  Classes, objects, constructors, public/private methods, poly, how things interact, etc. That's all down pact. I can also read documentation to get what I want out of public libraries most of the time.  

  

But man… I look at something like Leetcode and determine that I’ve landed on Mars. Data Management might as well be rocket science. GitHub might as well be Facebook for Klingon’s.  

  

I like to think that my problem solving skills are good enough, that I’m fairly clever, that I can be \*\*\*the master of the universe\*\*\*. Though isn’t that what anybody and everybody thinks? Each person on the planet assumes they’re above average and half of them are assuredly provably wrong.  

  

My portfolio is mainly .txt or the odd .exe files of stuff I’ve written, hosted on my basic ass web-page. \*(that I also wrote)\* I really should learn how to put things on GitHub.. Most of the programs I’ve written are this small petty beginner level, cookie cutter \*\*nonsense\*\*. For example the other day I made a C# windows form that keeps track of rocket league game stats. It saves a file with a custom .rtlg extension, and allows you to load that same .rtlg file to continue after you've closed the program. Vast majority of the things I’ve done are console applications, which are lame. I’ve used Java Swing as well. The knock with Windows forms and Java Swing is that everything looks like its from 1999. I’ve also built a simple webpage that accepts input from a text box and then stores the string into a MySQL server table. It is the only work I’ve ever done with any back-end data storage.  

  

What should my next move be? Learn how to put stuff on GitHub? I have a feeling that absolutely no employer is going to give two shits about some .txt files on my personal web-page. Even if by some miracle a person does find them, stating “nothing I have crafted is impressive” would be an understatement.  

  

When I look at Revature, I see a place that with an ability to swallow someone whole. But if I make it through, they guarantee a 45k a year honest to goodness job! Double anything I’ve ever earned! I know that 45k is under market value, and that we’re living in this scarce hyper-inflated hellscape, but it seems like my only shot.  

  

I’ve worn out my welcome at my current living situation and there’s an expectation that I’m finding a job once this semester is over and getting the fuck out. Getting a bachelors degree doesn’t seem viable at this time.

  

I’m still going to apply at other non Revature places. Willing to work literally anywhere in the USA \*(except New Jersey…. ok maybe New Jersey)\*, but I don’t think my prospects are great. If Revature is willing to have me \*(their website states you only need an associates degree)\* it seems like a great option. A paid bootcamp with a job waiting at the end.  

  

Also I’m not really a people person. I do ok when forced into social situations, but I don’t seek them out, and I’m dreadful at maintaining relationships.  

  

Sorry if this was more a collection of thoughts than a question. Thank you all in advance for advice.",True,False,False,cscareerquestions,t5_2sdpm,624536,public,self,Am I crazy or does Revature seem like a great option?,0,[],1.0,https://www.reddit.com/r/cscareerquestions/comments/qbhylw/am_i_crazy_or_does_revature_seem_like_a_great/,all_ads,6,,,,,,6cd5b88a-6eff-11e2-b3c1-22000aa610af,dark
[],False,GrandKnightMaster,,[],,text,t2_eo5dhbwm,False,False,False,[],False,False,1634668070,self.cscareerquestions,https://www.reddit.com/r/cscareerquestions/comments/qbhmds/computer_science_or_accounting_which_is_a_better/,{},qbhmds,False,True,False,False,False,True,True,False,,[],dark,text,False,False,True,20,0,False,all_ads,/r/cscareerquestions/comments/qbhmds/computer_science_or_accounting_which_is_a_better/,False,6,1634668081,1,"Which is the better career? Computer Science or accounting? in terms of a number of jobs, demand for your skillset, and opportunities in the field? With respects to North American market (US &amp; Canada)",True,False,False,cscareerquestions,t5_2sdpm,624526,public,self,Computer science or accounting which is a better career?,0,[],1.0,https://www.reddit.com/r/cscareerquestions/comments/qbhmds/computer_science_or_accounting_which_is_a_better/,all_ads,6,,,,,,,
[],False,sugandan,,[],,text,t2_e0665jvn,False,False,False,[],False,False,1634667987,self.cscareerquestions,https://www.reddit.com/r/cscareerquestions/comments/qbhle9/how_much_work_are_new_grads_expected_to_do_how/,{},qbhle9,False,True,False,False,False,True,True,False,,"[{'e': 'text', 't': 'New Grad'}]",dark,richtext,False,False,True,1,0,False,all_ads,/r/cscareerquestions/comments/qbhle9/how_much_work_are_new_grads_expected_to_do_how/,False,6,1634667998,1,"I recently just landed a job at a big manufacturing company. I'll be working in the R&amp;D department as a new grad SWE. I, admittedly coasted through college -- especially given my last few semesters were online (because of COVID). My coding skills are below par, if I'm being honest. I was just wondering how much work new grads typically get and how much knowledge we're expected to have coming into the job.",True,False,False,cscareerquestions,t5_2sdpm,624525,public,self,How much work are new grads expected to do? How much knowledge should we know coming in?,0,[],1.0,https://www.reddit.com/r/cscareerquestions/comments/qbhle9/how_much_work_are_new_grads_expected_to_do_how/,all_ads,6,05438160-1232-11e5-b573-0e1422b8b60b,New Grad,,,,,
[],False,crotega,,[],,text,t2_32j2ikkp,False,False,False,[],False,False,1634667897,self.cscareerquestions,https://www.reddit.com/r/cscareerquestions/comments/qbhk9x/is_it_tacky_to_discuss_cost_savings_and_personal/,{},qbhk9x,False,True,False,False,False,True,True,False,,[],dark,text,False,False,True,12,0,False,all_ads,/r/cscareerquestions/comments/qbhk9x/is_it_tacky_to_discuss_cost_savings_and_personal/,False,6,1634667909,1,"I’m genuinely curious. I’m a software engineer that works heavily alongside our marketing and financial teams, so I see the direct impact that my work has on the company. I’ve written applications that have saved us $600k annually, or upped conversion rate on our site that had impact in the millions.

Should I explicitly state these figures in my resume and when interviewing, or just be general and mention that I contributed to saving large amounts of money? They’re things I’m proud of, but I don’t want to come off as arrogant as it’s not uncommon for engineers to have these huge impacts on financials",True,False,False,cscareerquestions,t5_2sdpm,624525,public,self,Is it tacky to discuss cost savings and personal impact on the company?,0,[],1.0,https://www.reddit.com/r/cscareerquestions/comments/qbhk9x/is_it_tacky_to_discuss_cost_savings_and_personal/,all_ads,6,,,,,,,
