all_awardings,allow_live_comments,author,author_flair_css_class,author_flair_richtext,author_flair_text,author_flair_type,author_fullname,author_is_blocked,author_patreon_flair,author_premium,awarders,can_mod_post,contest_mode,created_utc,domain,full_link,gildings,id,is_created_from_ads_ui,is_crosspostable,is_meta,is_original_content,is_reddit_media_domain,is_robot_indexable,is_self,is_video,link_flair_background_color,link_flair_richtext,link_flair_text_color,link_flair_type,locked,media_only,no_follow,num_comments,num_crossposts,over_18,parent_whitelist_status,permalink,pinned,pwls,retrieved_on,score,selftext,send_replies,spoiler,stickied,subreddit,subreddit_id,subreddit_subscribers,subreddit_type,thumbnail,title,total_awards_received,treatment_tags,upvote_ratio,url,whitelist_status,wls,link_flair_template_id,link_flair_text,post_hint,preview,removed_by_category,author_flair_template_id,author_flair_text_color
[],False,Christopher876,,[],,text,t2_wy544,False,False,False,[],False,False,1634662114,self.cscareerquestions,https://www.reddit.com/r/cscareerquestions/comments/qbfjwk/graduating_december_2021_cannot_land_a_single/,{},qbfjwk,False,True,False,False,False,True,True,False,,[],dark,text,False,False,True,22,0,False,all_ads,/r/cscareerquestions/comments/qbfjwk/graduating_december_2021_cannot_land_a_single/,False,6,1634662126,1,"This might just be me feeling very defeated and sad and depressed right now as I receive my 4th rejection letter two weeks after the interview. It might really be me just emotional right now.

Anyway, I graduate in 2 months and like everyone else graduating soon, I am now looking for a job and have been applying to many places. I think I have around 200-300 applications now over the past 3 months. I have had multiple interviews now as I mentioned before.

I feel very depressed now and I do not know what I can do to improve my chances of getting a job offer. Every time the interviews go well and the interviewers love that I know so much and have so much knowledge of web development, both frontend and backend. They love that I have a project that I implemented OAuth2 authentication on the server, end to end encryption by myself and that I know all of the Linux commands and latest technologies in use there like Docker.

But, at the end of the day, every interview I do, they always come back to me and say that they went with someone that had more experience than me even though that candidate do not have as much knowledge as I do (I know this information due to recruiters). Literally last week I had an interview with Cisco where I nailed everything perfect and they were joking around with me and explaining everything that they do at the job, you know like when they want to offer you the job. Nope, three days later they hired someone else that knew less than me because they had graduated already. 

I didn't get lucky like everyone else where they had internships, all of my internships got cancelled last year because of COVID when I was a junior. I'm working at this teaching job, teaching Java, Javascript, HTML, CSS and C# for the past 2 years in January. I also am like a pseudo-manager and I manage the internal system we use that run Linux and deploys various things using docker, and I help maintain a few of website using Spring.

Now it is like at the back of my mind as I apply to 10-15 jobs each day now is that I am not good enough and I probably don't deserve anything. 

I'd love some advice, I don't have anyone to talk to these things about. What can I do better?",True,False,False,cscareerquestions,t5_2sdpm,624434,public,self,"Graduating December 2021, cannot land a single offer",0,[],1.0,https://www.reddit.com/r/cscareerquestions/comments/qbfjwk/graduating_december_2021_cannot_land_a_single/,all_ads,6,,,,,,,
[],False,ImmediateNebula5,,[],,text,t2_5taprn1e,False,False,False,[],False,False,1634662039,self.cscareerquestions,https://www.reddit.com/r/cscareerquestions/comments/qbfj0i/is_cybersecurity_a_bubble/,{},qbfj0i,False,True,False,False,False,True,True,False,,"[{'e': 'text', 't': 'Student'}]",dark,richtext,False,False,True,4,0,False,all_ads,/r/cscareerquestions/comments/qbfj0i/is_cybersecurity_a_bubble/,False,6,1634662051,1,I saw an article today where an Israeli tech billionaire said that cybersecurity was a bubble. Do you think there is a truth to what he said? What is the actual demand for cybersecurity professionals?,True,False,False,cscareerquestions,t5_2sdpm,624433,public,self,Is Cybersecurity a bubble?,0,[],1.0,https://www.reddit.com/r/cscareerquestions/comments/qbfj0i/is_cybersecurity_a_bubble/,all_ads,6,c9dd4bf2-b859-11e3-8535-12313d31e5b1,Student,,,,,
[],False,kibaeatstrash,,[],,text,t2_56ai6xqb,False,False,False,[],False,False,1634661491,self.cscareerquestions,https://www.reddit.com/r/cscareerquestions/comments/qbfc27/need_advice_on_what_path_to_follow_in_it/,{},qbfc27,False,True,False,False,False,True,True,False,,[],dark,text,False,False,True,18,0,False,all_ads,/r/cscareerquestions/comments/qbfc27/need_advice_on_what_path_to_follow_in_it/,False,6,1634661502,1,I have been trying to find a role that will be suitable for me. I tried development and I horribly suck at it and don't enjoy it. I enjoyed deploying web app using xyz cloud but it was not that difficult and I am good at managing people but my coding skills honestly suck. What can I honestly do and Excel in it. Please ignore if it's a shitty question. Sorry.,True,False,False,cscareerquestions,t5_2sdpm,624426,public,self,need advice on what path to follow in IT,0,[],0.99,https://www.reddit.com/r/cscareerquestions/comments/qbfc27/need_advice_on_what_path_to_follow_in_it/,all_ads,6,,,,,,,
[],False,throwaway-2asjdhf,,[],,text,t2_dpbn6tnx,False,False,False,[],False,False,1634661426,self.cscareerquestions,https://www.reddit.com/r/cscareerquestions/comments/qbfb88/scope_creep_entry_level_to_manager_at_startup/,{},qbfb88,False,True,False,False,False,True,True,False,,[],dark,text,False,False,True,12,0,False,all_ads,/r/cscareerquestions/comments/qbfb88/scope_creep_entry_level_to_manager_at_startup/,False,6,1634661437,1,"I was hired ~6 months ago as an entry level front-end dev at a large company but work on an isolated team that is very much like a startup. Quick decisions are made, direction of the product changes frequently/easily. However, the benefits of a startup like equity are not there.

I've been the only front-end developer since the beginning, but we are soon hiring more developers to work under me. I'm comfortable with this but am concerned that I'm now going to be managing several people on an entry level salary.

Here are my questions:
- Do fast-growing startups commonly give raises/promotions?
- How long does a large business (say 100+ employees) typically take to get a raise? Annually?
- Should I be concerned about these new responsibilities but still making what an entry level dev does?",True,False,False,cscareerquestions,t5_2sdpm,624425,public,self,"Scope creep (entry level to manager) at ""startup""",0,[],1.0,https://www.reddit.com/r/cscareerquestions/comments/qbfb88/scope_creep_entry_level_to_manager_at_startup/,all_ads,6,,,,,,,
[],False,fartking662,,[],,text,t2_cjykfw79,False,False,False,[],False,False,1634661394,self.cscareerquestions,https://www.reddit.com/r/cscareerquestions/comments/qbfati/including_phone_on_resumes/,{},qbfati,False,False,False,False,False,False,True,False,,[],dark,text,False,False,True,2,0,False,all_ads,/r/cscareerquestions/comments/qbfati/including_phone_on_resumes/,False,6,1634661406,1,[removed],True,False,False,cscareerquestions,t5_2sdpm,624425,public,self,Including Phone # on Resumes,0,[],1.0,https://www.reddit.com/r/cscareerquestions/comments/qbfati/including_phone_on_resumes/,all_ads,6,,,,,moderator,,
[],False,JeremieTavares,,[],,text,t2_6c51komx,False,False,False,[],False,False,1634661189,self.cscareerquestions,https://www.reddit.com/r/cscareerquestions/comments/qbf83n/i_just_bought_the_new_mb16_do_you_guys_think_of/,{},qbf83n,False,True,False,False,False,True,True,False,,[],dark,text,False,False,False,6,0,False,all_ads,/r/cscareerquestions/comments/qbf83n/i_just_bought_the_new_mb16_do_you_guys_think_of/,False,6,1634661200,1,I just bought the new MB16. Do you guys think of the specs? is it overkill? M1 MAX + 24-core GPU + 32GB ram. Im a Fullstack Web Dev and Mobile App Dev,True,False,False,cscareerquestions,t5_2sdpm,624422,public,self,I just bought the new MB16. Do you guys think of the specs? is it overkill? M1 MAX + 24-core GPU + 32GB ram. Im a Fullstack Web Dev and Mobile App Dev,0,[],1.0,https://www.reddit.com/r/cscareerquestions/comments/qbf83n/i_just_bought_the_new_mb16_do_you_guys_think_of/,all_ads,6,,,,,,,
[],False,Pariston,,[],,text,t2_7kwvd,False,False,False,[],False,False,1634661138,self.cscareerquestions,https://www.reddit.com/r/cscareerquestions/comments/qbf7hr/doubts_on_internship/,{},qbf7hr,False,True,False,False,False,True,True,False,,[],dark,text,False,False,True,5,0,False,all_ads,/r/cscareerquestions/comments/qbf7hr/doubts_on_internship/,False,6,1634661149,1,"Hello, quick background first: I am 30, on my 5th and last year of CS degree. I'm pretty late because of life trouble that led to me starting late and having to work (not cs-related jobs) while studying. 

I have been contacted by the HR of an important company for an internship and I assumed that they had looked at my profile before contacting me, which, along with a few questions on my known programming languages during the phone interview, led me to believe that I'd be in a software developer role, which is my desired career path and THE stuff I worked towards during these long years, towards which I also developed a passion I dare say. I may lack practical experience and not know what are the state-of-the-art best practices, but I feel competent and can I feel like I can learn anything with the notions I learned during my studies.

With that said, the company is trying to insert me into this department that is mostly dealing with server setup (upgrade from physical machines to virtual to save costs, machines that need to manage networks and connections from the little I gathered) and whenever I mention programming I get comments such as ""yeah that's a useful skill to have"", which implies that that's not at all what I will be learning (or doing).

My dilemma is the following: the company is pretty important, is serious and has some very good values, I really like the idea of working here. On the other hand I have no preparation and frankly no interest in what they are training me to do, to the point I get almost sick thinking that the bulk of my studying won't be of use. 

I know this might sound whiny and I realize that work isn't always about what you *want* to do, and I don't even know if this is the sub for this kind of questions, but this situation is really tough on me mentally right now and I could use some advice and guidance from a third party with more experience.

Thanks.",True,False,False,cscareerquestions,t5_2sdpm,624422,public,self,Doubts on internship,0,[],1.0,https://www.reddit.com/r/cscareerquestions/comments/qbf7hr/doubts_on_internship/,all_ads,6,,,,,,,
[],False,Prestigious-Value-65,,[],,text,t2_bcbek8ah,False,False,False,[],False,False,1634660954,self.cscareerquestions,https://www.reddit.com/r/cscareerquestions/comments/qbf51u/hubspot_final_round_tips/,{},qbf51u,False,True,False,False,False,True,True,False,,[],dark,text,False,False,True,1,0,False,all_ads,/r/cscareerquestions/comments/qbf51u/hubspot_final_round_tips/,False,6,1634660964,1,"I have my final round interview for Hubspot in a couple of days. Does anyone have any tips on preparing for it?

&amp;#x200B;

Thanks!",True,False,False,cscareerquestions,t5_2sdpm,624420,public,self,Hubspot Final Round Tips?,0,[],1.0,https://www.reddit.com/r/cscareerquestions/comments/qbf51u/hubspot_final_round_tips/,all_ads,6,,,,,,,
[],False,WeeklyGuidance2686,,"[{'e': 'text', 't': 'Student'}]",Student,richtext,t2_2w6g7b6p,False,False,False,[],False,False,1634660602,self.cscareerquestions,https://www.reddit.com/r/cscareerquestions/comments/qbf0tm/apolis_anyone_have_experience_with_it/,{},qbf0tm,False,False,False,False,False,False,True,False,,"[{'e': 'text', 't': 'New Grad'}]",dark,richtext,False,False,True,0,0,False,all_ads,/r/cscareerquestions/comments/qbf0tm/apolis_anyone_have_experience_with_it/,False,6,1634660612,1,[removed],True,False,False,cscareerquestions,t5_2sdpm,624419,public,self,Apolis — anyone have experience with it ?,0,[],1.0,https://www.reddit.com/r/cscareerquestions/comments/qbf0tm/apolis_anyone_have_experience_with_it/,all_ads,6,05438160-1232-11e5-b573-0e1422b8b60b,New Grad,,,moderator,83d15b5c-6eff-11e2-af5e-12313b0d44ba,dark
[],False,cloudswithclout,,[],,text,t2_6nsiykrj,False,False,False,[],False,False,1634660260,self.cscareerquestions,https://www.reddit.com/r/cscareerquestions/comments/qbewlx/should_i_add_an_upcoming_internship_to_my_resume/,{},qbewlx,False,False,False,False,False,False,True,False,,[],dark,text,False,False,True,2,0,False,all_ads,/r/cscareerquestions/comments/qbewlx/should_i_add_an_upcoming_internship_to_my_resume/,False,6,1634660272,1,[removed],True,False,False,cscareerquestions,t5_2sdpm,624414,public,self,Should I add an upcoming internship to my resume?,0,[],1.0,https://www.reddit.com/r/cscareerquestions/comments/qbewlx/should_i_add_an_upcoming_internship_to_my_resume/,all_ads,6,,,,,moderator,,
[],False,GodLog1,,[],,text,t2_e7grwfpz,False,False,False,[],False,False,1634659688,self.cscareerquestions,https://www.reddit.com/r/cscareerquestions/comments/qbepg1/how_to_become_a_scrum_master/,{},qbepg1,False,True,False,False,False,True,True,False,,[],dark,text,False,False,True,2,0,False,all_ads,/r/cscareerquestions/comments/qbepg1/how_to_become_a_scrum_master/,False,6,1634659699,1,"Safe agile, is most of what I hear.
 but what is needed to obtain this position? Certain degree, certificates? I’m already a software dev but would like to transition into this role. 
Advice is appreciated.",True,False,False,cscareerquestions,t5_2sdpm,624411,public,self,How to become a scrum master?,0,[],1.0,https://www.reddit.com/r/cscareerquestions/comments/qbepg1/how_to_become_a_scrum_master/,all_ads,6,,,,,,,
[],False,Areyoukiddingme338,,[],,text,t2_6gnq7mwp,False,False,False,[],False,False,1634658766,self.cscareerquestions,https://www.reddit.com/r/cscareerquestions/comments/qbedwm/should_i_reapply_for_a_job_i_already_applied_to/,{},qbedwm,False,True,False,False,False,True,True,False,,"[{'e': 'text', 't': 'Experienced'}]",dark,richtext,False,False,True,3,0,False,all_ads,/r/cscareerquestions/comments/qbedwm/should_i_reapply_for_a_job_i_already_applied_to/,False,6,1634658777,1,"Back in July I went through multiple rounds of interviews for a position at one of the big tech companies. I ended up not getting the job or much feedback as to why I was not selected, but it was a large tech company so I knew I was going to be up against the best of the best when interviewing for this role. Earlier this week they opened another spot on the same team. Should I reapply after I’ve already been rejected?",True,False,False,cscareerquestions,t5_2sdpm,624403,public,self,Should I reapply for a job I already applied to?,0,[],1.0,https://www.reddit.com/r/cscareerquestions/comments/qbedwm/should_i_reapply_for_a_job_i_already_applied_to/,all_ads,6,0968d7a4-1232-11e5-a323-0e1422b8b60b,Experienced,,,,,
[],False,Moedig25,,[],,text,t2_13dclh,False,False,False,[],False,False,1634658753,self.cscareerquestions,https://www.reddit.com/r/cscareerquestions/comments/qbedr9/recruiter_asking_what_i_work_on_in_my_spare_time/,{},qbedr9,False,True,False,False,False,True,True,False,,"[{'e': 'text', 't': 'Meta'}]",dark,richtext,False,False,True,13,0,False,all_ads,/r/cscareerquestions/comments/qbedr9/recruiter_asking_what_i_work_on_in_my_spare_time/,False,6,1634658764,1,"I'm a lead developer working for a large manufacturer, sometimes out of curiosity I dip my toes in the water to see what bites in the recruitment world and to see if anything takes my fancy.   
I'm a top 10% earner in my country, have great references and have some very niche skill sets which I have grown over the last few years. I'm 'originally' a full stack dev using Microsoft tech but have since branched out into Oracle, Android and other ecosystems. I'm good at my job and I enjoy it. 

However, I also enjoy work life balance. I'm not a dungeon dwelling introvert with no family or friends. I recently had contact with a recruiter for a position that, if anything, I was over qualified for. He refused to consider me and actually went so far as to belittle me over the phone on the basis that I told him outside of work hours I don't write my own side projects all day every day.

In the end I received a better offer from a separate company but turned them down based on their pension contribution being too low despite them repeatedly offering me a higher base salary (tax reasons).

It infuriates me that recruiters seem to think that just because we are developers we must do nothing but write code all day every day, or that we are 'lesser' developers for not doing so. 

Could you imagine if during an interview for a surgeons position they were asked 'and what surgery do you do outside of work? Do you have any patients who can show me your work?'. 

How about asking a policeman how many arrests he makes in his spare time.

We have families, hobbies and interests outside of this field. 

Is it just me or does this annoy anyone else?",True,False,False,cscareerquestions,t5_2sdpm,624403,public,self,Recruiter asking what I work on in my spare time [Rant],0,[],1.0,https://www.reddit.com/r/cscareerquestions/comments/qbedr9/recruiter_asking_what_i_work_on_in_my_spare_time/,all_ads,6,1ae775c6-1232-11e5-bc2c-0e9aedb4175b,Meta,,,,,
[],False,CoastieKid,,"[{'e': 'text', 't': 'Security Consultant'}]",Security Consultant,richtext,t2_flj6m,False,False,False,[],False,False,1634658612,self.cscareerquestions,https://www.reddit.com/r/cscareerquestions/comments/qbec38/is_product_management_just_glorified_middle/,{},qbec38,False,True,False,False,False,True,True,False,,[],dark,text,False,False,True,12,0,False,all_ads,/r/cscareerquestions/comments/qbec38/is_product_management_just_glorified_middle/,False,6,1634658623,1,"What are everyone's thoughts here - including PMs.  From my perspective as a security consultant, it seems that most Product Managers stay in Teams/Zoom/Webex meetings all day while SWE and DevOps people do the actual work.  Perhaps it's an ignorant view of mine, but for product facing roles it seems that SWE or even a sales rep is better of in terms of compensation as well.  Thoughts?",True,False,False,cscareerquestions,t5_2sdpm,624398,public,self,Is Product Management just glorified middle management? Not trying to start arguments here - saw on Blind the other day that someone thought it was over rated,0,[],1.0,https://www.reddit.com/r/cscareerquestions/comments/qbec38/is_product_management_just_glorified_middle/,all_ads,6,,,,,,9612b3e2-6eff-11e2-b4a5-22000aa610af,dark
[],False,SundropSavannah,,[],,text,t2_5li2ioyr,False,False,False,[],False,False,1634658374,self.cscareerquestions,https://www.reddit.com/r/cscareerquestions/comments/qbe99t/opinions_on_software_engineering_boot_camps_18f/,{},qbe99t,False,True,False,False,False,True,True,False,,[],dark,text,False,False,True,13,0,False,all_ads,/r/cscareerquestions/comments/qbe99t/opinions_on_software_engineering_boot_camps_18f/,False,6,1634658385,1,"I have my high school diploma and I am thinking about going to a school like App Academy, Flatiron, etc. Seems like a good way to save money and time and get into computer science. What do you guys think about those places? Are they worth the hype?",True,False,False,cscareerquestions,t5_2sdpm,624398,public,self,Opinions on software engineering boot camps? (18F),0,[],1.0,https://www.reddit.com/r/cscareerquestions/comments/qbe99t/opinions_on_software_engineering_boot_camps_18f/,all_ads,6,,,,,,,
[],False,StopBankTransfer,,[],,text,t2_4mtg4cat,False,False,False,[],False,False,1634658012,self.cscareerquestions,https://www.reddit.com/r/cscareerquestions/comments/qbe4pi/being_ghosted_by_a_recruiter_after_verbally/,{},qbe4pi,False,True,False,False,False,True,True,False,,[],dark,text,False,False,False,5,0,False,all_ads,/r/cscareerquestions/comments/qbe4pi/being_ghosted_by_a_recruiter_after_verbally/,False,6,1634658024,1,"Received a call last week from a recruiter about an offer and a package. This offer was not my highest offer but I liked the company more so I asked to recruiter if they could match. He said they could if I sent over my best offer letter. I did that and since it's been Radio silence. He's not responding to my emails and I have to respond to the first company soon. Not really sure what to do since I don't have an actual offer letter from the second company, just a verbal commitment.",True,False,False,cscareerquestions,t5_2sdpm,624394,public,self,Being ghosted by a recruiter after verbally receiving an offer?,0,[],1.0,https://www.reddit.com/r/cscareerquestions/comments/qbe4pi/being_ghosted_by_a_recruiter_after_verbally/,all_ads,6,,,,,,,
[],False,learningcodes,,[],,text,t2_8dovh1m4,False,False,False,[],False,False,1634657499,self.cscareerquestions,https://www.reddit.com/r/cscareerquestions/comments/qbdy7o/feel_like_a_failure/,{},qbdy7o,False,True,False,False,False,True,True,False,,[],dark,text,False,False,True,16,0,False,all_ads,/r/cscareerquestions/comments/qbdy7o/feel_like_a_failure/,False,6,1634657510,1," Been wondering about this, but does anyone feel like a failure if they don't work at FAANG? And if I do have this feeling what should I do to get rid of it?",True,False,False,cscareerquestions,t5_2sdpm,624385,public,self,Feel like a failure,0,[],1.0,https://www.reddit.com/r/cscareerquestions/comments/qbdy7o/feel_like_a_failure/,all_ads,6,,,,,,,
[],False,learningcodes,,[],,text,t2_8dovh1m4,False,False,False,[],False,False,1634657471,self.cscareerquestions,https://www.reddit.com/r/cscareerquestions/comments/qbdxu9/not_working_in_faang/,{},qbdxu9,False,False,False,False,False,False,True,False,,[],dark,text,False,False,True,2,0,False,all_ads,/r/cscareerquestions/comments/qbdxu9/not_working_in_faang/,False,6,1634657482,1,[removed],True,False,False,cscareerquestions,t5_2sdpm,624385,public,self,Not working in FAANG,0,[],1.0,https://www.reddit.com/r/cscareerquestions/comments/qbdxu9/not_working_in_faang/,all_ads,6,,,,,moderator,,
[],False,dolceespress,,[],,text,t2_ytdxi,False,False,False,[],False,False,1634657340,self.cscareerquestions,https://www.reddit.com/r/cscareerquestions/comments/qbdw3q/coworker_taking_all_the_credit_for_project/,{},qbdw3q,False,True,False,False,False,True,True,False,,"[{'e': 'text', 't': 'Experienced'}]",dark,richtext,False,False,False,0,0,False,all_ads,/r/cscareerquestions/comments/qbdw3q/coworker_taking_all_the_credit_for_project/,False,6,1634657350,1,"Full disclosure, I'm a more experienced Software Developer than my coworker.  I believe he's fairly new to the company, maybe here a year.  I've been doing this for around four years now.  When I was starting out, I had a coworker that mentored me and helped me a lot.  Now that I'm competent in developing, I want to be able to teach/mentor.  However, it's hard to find the balance between helping, or guiding in the right direction, and doing the work.  Furthermore, often times I'll have to play around with the code before being able to give advice because it won't really click until I do.

Long story short, this script my coworker was working on (and I was also assigned to contribute), I basically reworked it to the state it's currently in.  What he was doing was really bad. What he presented to business leaders would not be presentable if I did not step in and fix things. When I got  help in the past, I always gave shoutouts.  Additionally, if I worked on something with someone, I was always careful how I phrased things, like saying ""we worked on"" etc.  When he presents, he keeps phrasing as ""my scripts"", which makes it seem my contributions were minimal.  I will say that maybe my failure was taking over rather than guiding in the right direction? The reason I reworked things is because I tried explaining to him but he kept doing things incorrectly, so I figured I'd rework it to a point where he could add things.  

My first thought was, I'm never helping this kid again. And also, I figure there's git history, so maybe people will know. Idk what to do.  Am I overreacting?",True,False,False,cscareerquestions,t5_2sdpm,624384,public,self,Coworker taking all the credit for project,0,[],1.0,https://www.reddit.com/r/cscareerquestions/comments/qbdw3q/coworker_taking_all_the_credit_for_project/,all_ads,6,0968d7a4-1232-11e5-a323-0e1422b8b60b,Experienced,,,,,
[],False,ayerross00,,[],,text,t2_88bbhps2,False,False,False,[],False,False,1634657233,self.cscareerquestions,https://www.reddit.com/r/cscareerquestions/comments/qbduv5/java_ive_been_professionally_developing_for_15/,{},qbduv5,False,True,False,False,False,True,True,False,,[],dark,text,False,False,True,1,0,False,all_ads,/r/cscareerquestions/comments/qbduv5/java_ive_been_professionally_developing_for_15/,False,6,1634657245,1,I've been developing in Java for almost two years now. I'm not sure how to compare my progress to others developing this long to see if I'm on track/under prepared/over prepared as far as what all I should know at this point and wondered if anyone had any guidance on that.,True,False,False,cscareerquestions,t5_2sdpm,624381,public,self,[Java] I've been professionally developing for 1.5 years now. What should I know at this point?,0,[],1.0,https://www.reddit.com/r/cscareerquestions/comments/qbduv5/java_ive_been_professionally_developing_for_15/,all_ads,6,,,,,,,
